Source,Link,Headline,Description,Date,Timestamp,Topic,Author,Region,Article_Content
CNN,https://www.cnn.com/2024/09/01/world/video/six-hostages-killed-hamas-netanyahu-sot-intl-digvid,Netanyahu speaks on hostages being killed,Israel’s military said it has recovered the bodies of six hostages killed by Hamas militants in Gaza – including an Israeli-American captive – dealing fresh heartbreak to relatives who fear time is running out for loved ones seized by the militants ...,"Sep 1, 2024",2024-10-13 12:31:27.701089,Israel War,Unknown,Middle East,
CNN,https://www.cnn.com/2024/08/31/politics/video/donald-trump-election-subversion-case-hearing-litman-digvid,Robertson: 'Unusual' statement by IDF has raised expectations among families of Israeli hostages,The IDF is asking the public to refrain from speculation as they announced the discovery of bodies in Gaza. CNN’s Nic Robertson reports.,"Sep 1, 2024",2024-10-13 12:31:27.701089,Israel War,Nic Robertson,Middle East,
CNN,https://www.cnn.com/2024/08/29/Tv/video/amanpour-nili-margalit,"Netanyahu can bring hostages home now but chooses not to, says released Israeli hostage","Christiane Amanpour speaks with Nili Margalit, an Israeli nurse who was taken hostage by Hamas on October 7th and released after 55 days in captivity.","Aug 29, 2024",2024-10-13 12:31:27.701089,Israel War,Unknown,Middle East,
CNN,https://www.cnn.com/2024/08/28/world/video/west-bank-israel-operation-digvid,Israel launches major operation in West Bank,"Israel launched a large-scale raid in the West Bank on Wednesday, saying the operation was its most expansive in years.","Aug 28, 2024",2024-10-13 12:31:27.701089,Israel War,Unknown,Middle East,
CNN,https://www.cnn.com/2024/08/28/Tv/video/amanpour-mustafa-barghouti-west-bank,'Practically a war of a mighty Israeli army on civilian population': Palestinian politician on West Bank operation,"Christiane Amanpour speaks to Palestinian National Initiative President, Mustafa Barghouti, about Israel’s operations in the occupied West Bank.","Aug 28, 2024",2024-10-13 12:31:27.701089,Israel War,Unknown,Middle East,
CNN,https://www.cnn.com/2024/08/27/tv/video/amanpour-barak-ravid-hostage,Inside the surprise rescue of an Israeli hostage,CNN analyst and Axios reporter Barak Ravid speaks with Bianna Golodryga about the IDF’s rescue of Kaid Farhan Al-Qadi from a tunnel in southern Gaza.,"Aug 27, 2024",2024-10-13 12:31:27.701089,Israel War,Ben Kirby,Middle East,
CNN,https://www.cnn.com/2024/08/27/world/video/sciutto-hostage-rescue-operation-tunnel-gaza-digvid,Sciutto on significant detail that stands out about Israel's hostage rescue,"Israel’s military says it has rescued Kaid Farhan Al-Qadi a 52-year-old hostage held by Hamas since October 7, in a “complex operation” in southern Gaza. CNN’s Jim Sciutto reports. ","Aug 27, 2024",2024-10-13 12:31:27.701089,Israel War,Unknown,Middle East,
CNN,https://www.cnn.com/2024/08/26/world/video/israeli-students-return-school-south-lebanese-october-7-attack-sciutto-sitroom-digvid,Israeli students uprooted from school to get new school building,CNN’s Jim Sciutto visits a new school in Israel south of the Lebanese border that be attended by students who were uprooted from their school as tensions rise in region.,"Aug 27, 2024",2024-10-13 12:31:27.701089,Israel War,Jim Sciutto,Middle East,
CNN,https://www.cnn.com/world/live-news/israel-hamas-iran-hezbollah-intl-latam/index.html,Israel and Hezbollah trade fire in major flare-up,"Hezbollah launched a barrage of strikes at Israel in retaliation for the killing of a top military commander last month. Shortly before that attack, Israel launched what it called “preemptive strikes” against the group","Aug 26, 2024",2024-10-13 12:31:27.701089,Israel War,Simone McCarthy,Middle East,
CNN,https://www.cnn.com/2024/08/25/world/video/hezbollah-mideast-strikes-reaction-wedeman-digvid,Hezbollah leader: We will ‘wait and see’ if there will be more strikes,"Hezbollah secretary general Hassan Nasrallah said the group’s latest attack on Israel has been completed, but further strikes could be carried out in the future. CNN’s Ben Wedeman reports.","Aug 26, 2024",2024-10-13 12:31:27.701089,Israel War,Ben Wedeman,Middle East,
CNN,https://www.cnn.com/2024/08/25/world/video/gps0825-gaza-ceasefire-negotiations-face-challenges,On GPS: Why a Middle East peace deal may not happen,Bianna Golodryga speaks to Haaretz journalist Amos Harel and Suzanne Maloney of the Brookings Institution about the ongoing ceasefire talks in Cairo — and why so many players involved are not interested in a deal.,"Aug 25, 2024",2024-10-13 12:31:27.701089,Israel War,Bianna Golodryga,Middle East,
CNN,https://www.cnn.com/2024/08/25/world/video/gps0825-israel-strikes-hezbollah,On GPS: A closer look at the Israel-Hezbollah escalation,Bianna Golodryga hears from Suzanne Maloney of the Brookings Institution and Haaretz journalist Amos Harel about the implications of some of the fiercest cross-border strikes between Israel and Hezbollah in months.,"Aug 25, 2024",2024-10-13 12:31:27.701089,Israel War,Bianna Golodryga,Middle East,
CNN,https://www.cnn.com/2024/08/25/world/video/hezbollah-israel-strikes-military-civilians-dozier-digvid,Kim Dozier explains what’s ‘notable’ about Hezbollah’s strikes,CNN global affair analyst Kim Dozier explains what was notable to her about Hezbollah’s decision to launch strikes toward Israel in what they say is retaliation for the killing of a top military commander.,"Aug 25, 2024",2024-10-13 12:31:27.701089,Israel War,Unknown,Middle East,
CNN,https://www.cnn.com/2024/08/25/world/video/hezbollah-israel-strike-timeline-robertson-sot-ctm-digvid,How Israel was able to launch 'preemptive' strikes on Hezbollah,CNN’s Nic Robertson reports from Tel Aviv on the timeline of the escalation between Hezbollah and Israel.,"Aug 25, 2024",2024-10-13 12:31:27.701089,Israel War,Unknown,Middle East,
CNN,https://www.cnn.com/2024/08/23/world/video/gaza-israeli-strikes-peace-talks-robertson-sitroom-digvid,Gaza faces ongoing devastation despite peace talks,CNN’s Nic Robertson reports from Gaza as devastation continues in the region despite ongoing peace talks.,"Aug 24, 2024",2024-10-13 12:31:27.701089,Israel War,Nic Robertson,Middle East,
CNN,https://www.cnn.com/2024/08/22/politics/video/israeli-hostage-parents-address-dnc-fst-082107pseg2,Hostage's parents to DNC: There is a surplus of agony on all sides in the Middle East,"The mother and father of American-Israeli hostage Hersh Goldberg-Polin spoke on the third night of the Democratic National Convention, saying that bringing hostages home from Gaza is not a political issue, but a humanitarian one.","Aug 22, 2024",2024-10-13 12:31:27.701089,Israel War,Unknown,Middle East,
CNN,https://www.cnn.com/2024/08/20/tv/video/amanpour-tanya-haj-hassan,'It haunts us in our dreams': Doctor speaks out at the DNC about what she saw in Gaza,"Christiane Amanpour speaks to pediatric intensive care doctor, Tanya Haj-Hassan, who has worked in Gaza’s hospitals.","Aug 21, 2024",2024-10-13 12:31:27.701089,Israel War,Unknown,Middle East,
CNN,https://www.cnn.com/2024/08/20/world/video/a-heartbreaking-story-of-survival-a-mothers-tragic-tale-from-war-torn-gaza,A heartbreaking story of survival: A mother’s tragic tale from war-torn Gaza,"Five-year-old Shams and her mother, Sanaa, share their heartbreaking story of loss and survival in war-torn Gaza, facing the trauma of violence and the death of family members. CNN’s Jeremy Diamond reports.","Aug 20, 2024",2024-10-13 12:31:27.701089,Israel War,Unknown,Middle East,
CNN,https://www.cnn.com/2024/08/18/world/video/fareeds-take-iran-deal-middle-east-conflict-fareed-gps-digvid,How the failure of America's Iran deal is now affecting Middle East,CNN’s Fareed Zakaria gives his take on how the US’ handling of Iran and the nuclear deal is now affecting the growing tensions in the Middle East.,"Aug 18, 2024",2024-10-13 12:31:27.701089,Israel War,Fareed Zakaria,Middle East,
CNN,https://www.cnn.com/2024/08/17/world/video/gaza-israel-evacuations-hamas-ldn-digvid,‘We are like slaves’: Israeli military gives Gaza residents a few hours to evacuate,"On August 16, the Israeli military gave Gaza residents living in parts of the humanitarian zone in Khan Younis an order to evacuate in just a few hours. The UN Office for the Coordination of Humanitarian Affairs (OCHA) says the order ...","Aug 18, 2024",2024-10-13 12:31:27.701089,Israel War,Unknown,Middle East,
CNN,https://www.cnn.com/2024/08/17/world/video/west-bank-israeli-settlers-attack-jit-robertson-nr-digvid,Israeli settlers brazenly attack West Bank town,Israeli settlers fired bullets at residents of the Palestinian town of Jit in the West Bank before setting fires to homes and cars. CNN’s Nic Robertson spoke to residents who survived the deadly rampage.,"Aug 17, 2024",2024-10-13 12:31:27.701089,Israel War,Unknown,Middle East,
CNN,https://www.cnn.com/2024/08/16/tv/video/sitroom-israel-families-kibbutz,Families return to Kibbutz targeted by Hamas 10 months later,"Wolf Blitzer traveled to Kibbutz Mefalsim which is less than a mile from the Gaza Border. This week several hundred families from the Kibbutz are moving home after living in a hotel in Israel for 10-months. On October 7th their Kibbutz, was ...","Aug 17, 2024",2024-10-13 12:31:27.701089,Israel War,Wolf Blitzer,Middle East,
CNN,https://www.cnn.com/2024/08/16/world/video/west-bank-jit-settler-attack-digvid,Deadly Israeli settler attack leaves Palestinian West Bank town devastated,"Israeli settlers fired bullets and teargas at residents of the Palestinian town of Jit in the West Bank before setting fires to homes and cars in an attack, killing one Palestinian. A statement from the office of Israeli Prime Minister Benjamin ...","Aug 16, 2024",2024-10-13 12:31:27.701089,Israel War,Unknown,Middle East,
CNN,https://www.cnn.com/2024/08/15/world/video/wolf-interview-hamas-kidnapped-hostage-sitroom-digvid,Hear from woman who’s husband is still held by Hamas,"Israeli Gali Idan speaks with CNN’s Wolf Blitzer nearly a year after her daughter was killed by Hamas and her husband was taken hostage, and he remains in Gaza.","Aug 16, 2024",2024-10-13 12:31:27.701089,Israel War,Unknown,Middle East,
CNN,https://www.cnn.com/2024/08/15/tv/video/amanpour-rahm-emanuel-ambassador-japan-china-israel,"China 'the isolated party' in the region, says Rahm Emanuel","Rahm Emanuel, US Ambassador to Japan, speaks to Christiane Amanpour from Tokyo about American foreign policy and a rising China.","Aug 15, 2024",2024-10-13 12:31:27.701089,Israel War,Unknown,Middle East,
CNN,https://www.cnn.com/2024/08/14/world/video/israeli-photojournalist-ziv-koren-images-october-7-attack-wolf-blitzer-pkg-tsr-digvid,Israeli photojournalist speaks about images he captured from October 7 Hamas attack,Israeli photojournalist Ziv Koren speaks with CNN’s Wolf Blitzer about images he captured from the October 7 Hamas attacks.,"Aug 15, 2024",2024-10-13 12:31:27.701089,Israel War,Wolf Blitzer,Middle East,
CNN,https://www.cnn.com/2024/08/14/world/video/amanpour-israel-abuse-prison-btselem-yuli-novak,Head of Israeli rights organization details torture and abuse of Palestinians inside Israeli prisons,"Christiane speaks with Yuli Novak, head of B’Tselem, about their report alleging serious abuses inside Israeli detention centers and prisons – allegations which the IDF and the prison service deny.","Aug 14, 2024",2024-10-13 12:31:27.701089,Israel War,Henry Hullah,Middle East,
CNN,https://www.cnn.com/2024/08/13/tv/video/israel-netanyahu-ceasefire-idf-guy-zur,"The most moral step now is to bring home the hostages, retired IDF Major General says","Guy Zur, retired IDF Major General, talks to Christiane Amanpour about the pressure on Israeli Prime Minister Benjamin Netanyahu to bring home the hostages.","Aug 13, 2024",2024-10-13 12:31:27.701089,Israel War,Unknown,Middle East,
CNN,https://www.cnn.com/2024/08/12/tv/video/amanpour-javid-abdelmoneim-gaza,'They've lost hope': MSF doctor describes life in Gaza,"Christiane Amanpour speaks to MSF medical team leader, Dr. Javid Abdelmoneim, about the two months he spent working in Gaza’s hospitals.","Aug 12, 2024",2024-10-13 12:31:27.701089,Israel War,Unknown,Middle East,
CNN,https://www.cnn.com/2024/08/11/world/video/gps-0811-israel-braces-for-retaliation,On GPS: Israel braces for retaliation,"After a series of high-level assassinations, Israel is bracing for potential reprisals from Iran and Hezbollah. Fareed asks New York Times Magazine staff writer Ronen Bergman what such retaliation could look like and how Israeli citizens and ...","Aug 11, 2024",2024-10-13 12:31:27.701089,Israel War,Fareed Zakaria,Middle East,
CNN,https://www.cnn.com/2024/08/11/world/video/gps-0811-fears-of-escalation-in-lebanon,On GPS: What an all-out war could look like for Lebanon,"Maha Yahya, director of the Carnegie Middle East Center joins Fareed from Beirut. Yahya discusses how an all-out war could hurt Lebanon and how Iran and Hezbollah might respond to recent assassinations: “The intention would be to ...","Aug 11, 2024",2024-10-13 12:31:27.701089,Israel War,Fareed Zakaria,Middle East,
CNN,https://www.cnn.com/2024/08/10/world/video/israeli-school-strike-gaza-intl-ward-digvid,Videos show aftermath of fifth Gaza school hit this week,"At least 90 Palestinians have been killed in an Israeli strike on a school and mosque in Gaza sheltering displaced people, according to local officials. Witnesses said there was no advance warning of the attack. The Israel Defense ...","Aug 10, 2024",2024-10-13 12:31:27.701089,Israel War,Unknown,Middle East,
CNN,https://www.cnn.com/2024/08/09/world/video/israel-sde-teiman-alleged-prisoner-abuse-footage-diamond-tsr-digvid,Video appears to show Israeli soldiers sexually assaulting a Palestinian detainee,New surveillance video footage appears to show Israeli soldiers sexually assaulting a Palestinian detainee inside the notorious Sde Teiman prison. The Israel military has declined to comment on the surveillance video. CNN’s Jeremy Diamond ...,"Aug 10, 2024",2024-10-13 12:31:27.701089,Israel War,Jeremy Diamond,Middle East,
CNN,https://www.cnn.com/2024/08/06/world/video/israel-gaza-bodies-exhumed-karadsheh-pkg-ldn-digvid,Shocking video shows 89 bodies returned to Gaza by Israel,"Palestinian authorities in Khan Younis, Gaza, carried out a mass burial of 89 bodies returned to the territory by the Israeli military. Residents desperate for information about missing loved ones gathered at Khan Younis’ Turkish ...","Aug 7, 2024",2024-10-13 12:31:27.701089,Israel War,Unknown,Middle East,
CNN,https://www.cnn.com/2024/08/06/world/video/israeli-reservists-gaza-jeremy-diamond-pkg,Hear why some Israeli reservists would rather risk prison than go back to fight in Gaza,"Like thousands of Israeli reservists, Michael Ofer Ziv and Yuval Green were called up to war following the Hamas-led attacks on Israel on October 7th. After serving in Gaza and witnessing the military’s destructive approach, they tell CNN’s ...","Aug 6, 2024",2024-10-13 12:31:27.701089,Israel War,Zeena Saifi,Middle East,
CNN,https://www.cnn.com/videos/world/2024/08/05/exp-lebanon-beirut-port-blast-hezbollah-wedeman-pkg.cnn,Lebanon marks fourth anniversary of Beirut port blast,The Beirut port blast four years ago left an open wound on a country already full of scars … and now braced for more wounds. CNN’s Ben Wedeman reports.,"Aug 5, 2024",2024-10-13 12:31:27.701089,Israel War,Unknown,Middle East,
CNN,https://www.cnn.com/2024/08/05/tv/video/amanpour-barak-ehud,"Ehud Barak: Haniyeh’s assassination ‘did not help, to say the least,’ in releasing the hostages",Bianna Golodryga speaks with former Israeli Prime Minister Ehud Barak about the possibility for all out war in the Middle East.,"Aug 5, 2024",2024-10-13 12:31:27.701089,Israel War,Unknown,Middle East,
CNN,https://www.cnn.com/2024/08/05/world/video/abu-dhabi-fintech-mme-spc-intl,Abu Dhabi's fintech revolution is shaping its post-oil future,"Abu Dhabi is transforming into a fintech powerhouse, attracting top talent and harnessing the potential of its Hub71 tech ecosystem as part of its strategy for sustainable growth.","Aug 5, 2024",2024-10-13 12:31:27.701089,Israel War,Unknown,Middle East,
CNN,https://www.cnn.com/2024/08/05/world/video/israel-offensive-gaza-hamas-reconstitution-data-qiblawi-investigation-pkg-digvid,See how data analyses contradicts Netanyahu’s claim about war in Gaza,"Nearly half of Hamas’ military battalions in northern and central Gaza have rebuilt some of their fighting capabilities despite more than nine months of Israel’s brutal offensive, according to analyses by the DC-based American Enterprise ...","Aug 7, 2024",2024-10-13 12:31:27.701089,Israel War,Unknown,Middle East,
CNN,https://www.cnn.com/2024/08/04/world/video/hertling-israel-hamas-iran-nr-digvid,Ret. US general predicts how Iran could escalate attacks against Israel,Retired US Army Lt. Gen. Mark Hertling joins CNN as the Middle East braces for possible Iranian retaliation for the killing of a senior Hamas leader in Tehran.,"Aug 5, 2024",2024-10-13 12:31:27.701089,Israel War,Unknown,Middle East,
CNN,https://www.cnn.com/2024/08/04/world/video/gaza-school-shelter-israel-airstrike-diamond-digvid,Video shows aftermath of airstrike on Gaza school buildings,"Rescuers in Gaza raced to dig victims from the rubble after Israeli airstrikes on two school buildings left at least 30 people dead, according to the Palestinian Civil Defense. CNN’s Jeremy Diamond reports.","Aug 5, 2024",2024-10-13 12:31:27.701089,Israel War,Jeremy Diamond,Middle East,
CNN,https://www.cnn.com/2024/08/04/politics/video/finer-sotu-full-interview,WH official: US ‘preparing for every possibility’ as Iran threatens to retaliate against Israel,Deputy National Security Adviser Jon Finer joins CNN’s Dana Bash to discuss escalating tensions in the Middle East after the assassination of a top Hamas official in Iran.,"Aug 4, 2024",2024-10-13 12:31:27.701089,Israel War,Dana Bash,Middle East,
CNN,https://www.cnn.com/2024/08/04/politics/video/sotu-finer-gaza-hostage-deal,WH official: US ‘putting as much pressure as we can’ to achieve Gaza hostage deal,Deputy National Security Adviser Jon Finer tells CNN’s Dana Bash “there is not currently a deal in place” for a ceasefire in Gaza and says “we want the parties back at the table.”,"Aug 4, 2024",2024-10-13 12:31:27.701089,Israel War,Dana Bash,Middle East,
CNN,https://www.cnn.com/2024/08/04/world/video/gps-0804-rising-middle-east-tensions,On GPS: Why ‘there are very few winners’ in the Middle East escalation,"Fareed talks to New Yorker staff writer Robin Wright and Johns Hopkins professor Vali Nasr about whether the spree of assassinations in the Middle East could widen the conflict, as Israel braces for a possible attack from Iran.","Aug 4, 2024",2024-10-13 12:31:27.701089,Israel War,Darsen Hover,Middle East,
CNN,https://www.cnn.com/2024/08/04/world/video/gps0804-usinfluenceoverisrael,On GPS: Does the US actually have any influence over Israel?,Fareed speaks to New Yorker staff writer Robin Wright and Johns Hopkins professor Vali Nasr about how the US could work to calm tensions in the Middle East.,"Aug 4, 2024",2024-10-13 12:31:27.701089,Israel War,Waleed Nasir,Middle East,
CNN,https://www.cnn.com/2024/08/03/world/video/middle-east-tension-iran-israel-us-andrew-miller-nr-digvid,Expert explains how Israel could face 'extraordinarily dangerous' moment,"CNN’s Jim Sciutto speaks with the Former Deputy Assistant Secretary of State for Israeli-Palestinian Affairs Andrew Miller about the Middle East, as the region braces for an Iranian retaliation to the killing of a senior Hamas leader in Tehran.","Aug 3, 2024",2024-10-13 12:31:27.701089,Israel War,Unknown,Middle East,
CNN,https://www.cnn.com/world/live-news/israel-hamas-haniyeh-iran-tensions-08-02-24/index.html,US moves warships to Middle East as regional tensions rise,Hamas political leader Ismail Haniyeh was buried Friday in Doha as his killing raises fears that Israel’s conflict with Hamas could spiral into a regional war.,"Aug 3, 2024",2024-10-13 12:31:27.701089,Israel War,Chris Lau,Middle East,
CNN,https://www.cnn.com/2024/08/02/world/video/gaza-rafah-crossing-analysis-lon-digvid,A CNN analysis shows major artery for aid in Gaza is destroyed,An intended limited operation in Rafah has turned into a decimation of the area and the closure of what was once a main evacuation route for aid workers and injured Palestinians.,"Aug 2, 2024",2024-10-13 12:31:27.701089,Israel War,Unknown,Middle East,
CNN,https://www.cnn.com/2024/08/02/world/video/john-kirby-israel-iran-tension-cnc-ldn-digvid,Kirby explains why Biden is considering deploying troops to Middle East,President Joe Biden voiced his concern about the rising tension between Israel and Iran after Hamas political leader Ismail Haniyeh was killed in Tehran. US National Security Council spokesman John Kirby spoke to CNN’s Kate Bolduan ...,"Aug 2, 2024",2024-10-13 12:31:27.701089,Israel War,Unknown,Middle East,
CNN,https://www.cnn.com/world/live-news/israel-hamas-haniyeh-iran-tensions-08-01-24-intl-hnk/index.html,"August 1, 2024 Middle East conflict","Israel said a strike last month killed Mohammed Deif, head of Hamas’ military wing - the third high-profile figure in Iran-backed militant groups to be killed in recent weeks. Follow for live updates.","Aug 2, 2024",2024-10-13 12:31:27.701089,Israel War,Kathleen Magramo,Middle East,
CNN,https://www.cnn.com/2024/08/01/tv/video/amanpour-yuval-green-gaza,"'We don't care enough' about Palestinian lives, says former IDF paratrooper","Serving as an IDF reservist in Gaza, Yuval Green says he witnessed destruction, looting and a desire for revenge by fellow soldiers, and will no longer serve. He describes his experience to Bianna Golodryga. In an earlier statement to ABC ...","Aug 1, 2024",2024-10-13 12:31:27.701089,Israel War,Unknown,Middle East,
CNN,https://www.cnn.com/2024/08/01/world/video/idf-drone-strike-video-mohammed-deif-hamas-digvid,IDF says video shows strike that killed Hamas military leader,"The IDF now says they killed Mohammed Deif, Hamas’ military chief in Gaza, in a July airstrike. The IDF released video of the strike in Khan Yunis, Gaza. At least 90 Palestinians were reportedly killed in the strike that hit a displacement camp, ...","Aug 1, 2024",2024-10-13 12:31:27.701089,Israel War,Unknown,Middle East,
CNN,https://www.cnn.com/2024/08/01/world/video/israel-hamas-haniyeh-iran-tensions-digvid,See massive funeral procession for assassinated Hamas leader underway in Tehran,"Hamas political leader Ismail Haniyeh was killed in Tehran. While Israel has not confirmed its involvement, Iran’s Supreme Leader has vowed a response, raising concerns about potential violence. CNN’s Selma Abdulaziz reports.","Aug 1, 2024",2024-10-13 12:31:27.701089,Israel War,Unknown,Middle East,
CNN,https://www.cnn.com/world/live-news/hamas-political-leader-haniyeh-killed-iran-07-31-24/index.html,"July 31, 2024 - Hamas political leader killed, Israel strikes Beirut",Hamas political leader Ismail Haniyeh has been killed in Tehran. Follow for the latest news.,"Aug 1, 2024",2024-10-13 12:31:27.701089,Israel War,Kathleen Magramo,Middle East,
CNN,https://www.cnn.com/2024/07/31/world/video/palestinians-react-assassination-ismail-haniyeh-digvid,'Why did they kill this man?': Some Palestinians react to assassination of Ismail Haniyeh,Palestinians mourn the assassination of Hamas leader Ismael Haniyeh. Haniyeh was Hamas’ most public figure who headed the group’s political operations while living overseas.,"Aug 1, 2024",2024-10-13 12:31:27.701089,Israel War,Unknown,Middle East,
CNN,https://www.cnn.com/2024/07/31/world/video/hamas-political-leader-assassination-potential-impact-hostages-yifat-zailer-ward-lead-digvid,Israeli hostage relative on her ‘worst fear’ after assassination of Hamas political leader,"CNN’s Clarissa Ward speaks with Yifat Zailer, whose relatives have been held in Hamas captivity for approximately 300 days, about her thoughts following the assassination of Hamas political leader  Ismail Haniyeh.","Aug 1, 2024",2024-10-13 12:31:27.701089,Israel War,Unknown,Middle East,
CNN,https://www.cnn.com/2024/07/31/world/video/netanyahu-israel-enemies-crushing-blows-sot-digvid,Netanyahu: Israel has delivered 'crushing blows' to enemies in last few days,Israeli Prime Minister Benjamin Netanyahu said during a televised statement that Israel has delivered “crushing blows” to its enemies in the last few days.,"Aug 1, 2024",2024-10-13 12:31:27.701089,Israel War,Unknown,Middle East,
CNN,https://www.cnn.com/2024/07/31/tv/video/amanpour-golodryga-hayman-hezbollah,Ex-IDF Intelligence Chief foresees limited Hezbollah retaliation,Bianna Golodryga interviews Tamir Hayman on potential responses to the recent assassinations of a Hezbollah commander in Beirut and a Hamas leader in Tehran.,"Jul 31, 2024",2024-10-13 12:31:27.701089,Israel War,Unknown,Middle East,
CNN,https://www.cnn.com/2024/07/31/tv/video/amanpour-golodryga-clarke-haniyeh,‘The point was to sideline negotiations’: Terrorism expert on Netanyahu’s motive for double assassinations,"Colin Clarke, Director of Research at The Soufan Group, says Israeli Prime Minister Benjamin Netanyahu left the U.S. “fully intent” on launching targeted attacks in Lebanon and Iran","Jul 31, 2024",2024-10-13 12:31:27.701089,Israel War,Unknown,Middle East,
CNN,https://www.cnn.com/2024/07/31/tv/video/amanpour-lebanon-nabih-bulos,Fears of an all-out war: The view from Lebanon,"Nabih Bulos, Middle East Bureau Chief for The Los Angeles Times, talks to Bianna Golodrgya about fears of a wider war following the killings of a Hezbollah commander in Beirut, and a Hamas leader in Tehran.","Jul 31, 2024",2024-10-13 12:31:27.701089,Israel War,Unknown,Middle East,
