Source,Link,Headline,Description,Date,Timestamp,Topic,Author,Region,Article_Content
CNN,https://www.cnn.com/2024/10/02/world/video/beirut-israel-airstrikes-ldn-digvid,CNN goes to southern suburbs of Beirut after Israeli airstrikes,"CNN Senior International Correspondent, Ben Wedeman, looks at the damage done to a southern suburb of Beirut after Israeli airstrikes. The recent attacks have killed more than a thousand people, destroyed homes and displaced about 1 ...","Oct 2, 2024",2024-10-13 12:31:27.701089,Israel War,Unknown,Middle East,
CNN,https://www.cnn.com/world/live-news/israel-lebanon-war-hezbollah-10-1-24-intl-hnk/index.html,"October 1, 2024 Iran launches missile attack on Israel",Iran launched a massive missile attack on Israel in response to the killing of Hezbollah leader Hassan Nasrallah and others. Follow for live news updates.,"Oct 2, 2024",2024-10-13 12:31:27.701089,Israel War,Lex Harvey,Middle East,
CNN,https://www.cnn.com/2024/10/01/politics/video/iran-strike-jd-vance-tim-walz-cbs-vice-presidential-debate-digvid,Hear candidates' responses on support for preemptive Israeli strike on Iran,Vice presidential candidates Sen. JD Vance (R-OH) and Gov. Tim Walz (D-MN) answer a question about whether they would support Israel making a preemptive strike against Iran.,"Oct 2, 2024",2024-10-13 12:31:27.701089,Israel War,Unknown,Middle East,
CNN,https://www.cnn.com/2024/10/01/world/video/naftali-bennett-israel-iran-attack-antonio-guterres-ceasefire-blitzer-digvid,Former Israeli prime minister calls for UN secretary general to step down after response to Iran's attack,Former Israeli Prime Minister Naftali Bennett joined CNN’s Wolf Blitzer after Iran launched a missile attack on Israel. Bennett rebuked UN Secretary-General António Guterres’ response “condemning the broadening of the Middle East ...,"Oct 2, 2024",2024-10-13 12:31:27.701089,Israel War,Unknown,Middle East,
CNN,https://www.cnn.com/2024/10/01/world/video/iran-celebrates-missiles-israel-digvid,People of Gaza and Iran celebrate response of missile attack into Israel,Iranians and Gazans are shown celebrating as missiles launched by Iran fire at Israel in an attack Tuesday. Iran’s Islamic Revolutionary Guard Corps said the attack focused on Israeli security and military targets and was in response to the ...,"Oct 2, 2024",2024-10-13 12:31:27.701089,Israel War,Janelle Gonzalez,Middle East,
CNN,https://www.cnn.com/2024/10/01/world/video/the-lead-iran-israel-missile-strike-war-middle-east-hezbollah-lebanon-jake-tapper,Fmr. Defense Secy: Israel will conceivably target Iran's nuclear facilities,Fmr. Defense Secy William Cohen joins The Lead,"Oct 2, 2024",2024-10-13 12:31:27.701089,Israel War,Unknown,Middle East,
CNN,https://www.cnn.com/2024/10/01/world/video/the-lead-israel-iran-attack-missile-strike-hezbolla-lebanon-jake-tapper,"IDF: There will be ""consequences"" for Iran missile attack",Lt Col Nadav Shoshani joins The Lead,"Oct 2, 2024",2024-10-13 12:31:27.701089,Israel War,Unknown,Middle East,
CNN,https://www.cnn.com/2024/10/01/world/video/iran-missile-attack-aftermath-video-israel-digvid,See first look at damage caused by Iran's missile attack on Israel,Missiles rained down on Israel as Iran launched an attack on Tuesday. See the first images of damage from the barrage of missile fire.,"Oct 2, 2024",2024-10-13 12:31:27.701089,Israel War,Unknown,Middle East,
CNN,https://www.cnn.com/2024/10/01/world/video/jake-sullivan-iran-missile-attack-israel-digvid,National Security Adviser Jake Sullivan gives an update on Iran's attack,US National Security Adviser Jake Sullivan says Israel and the US defeated a large missile attack from Iran into Israel.,"Oct 2, 2024",2024-10-13 12:31:27.701089,Israel War,Unknown,Middle East,
CNN,https://www.cnn.com/2024/10/01/world/video/israel-iran-attack-barak-ravid-digvid,Will Israel strike Iran's nuclear sites? Hear what expert thinks,CNN political and global affairs analyst Barak Ravid discusses Iran’s missile attack on Israel and how Israel may respond.,"Oct 1, 2024",2024-10-13 12:31:27.701089,Israel War,Unknown,Middle East,
CNN,https://www.cnn.com/2024/10/01/world/video/video-iran-missiles-israel-digvid,Video shows Iranian missiles in the skies across Israel,"Iran has launched a missile attack on Israel. Sirens sounded across the country as CNN teams on the ground saw dozens of missiles over the cities of Tel Aviv, Jerusalem and Haifa.","Oct 1, 2024",2024-10-13 12:31:27.701089,Israel War,Unknown,Middle East,
CNN,https://www.cnn.com/2024/10/01/world/video/iran-attack-israel-video-sciutto-digvid,Video shows Iranian missile attack on Israel,"Missiles have been launched from Iran to Israel, according to an Israel Defense Forces statement. CNN’s Jim Sciutto reports from Tel Aviv.","Oct 1, 2024",2024-10-13 12:31:27.701089,Israel War,Unknown,Middle East,
CNN,https://www.cnn.com/2024/10/01/world/video/lebanon-underground-tunnels-digvid,IDF releases footage showing underground tunnels in Lebanon,"Israel has been conducting cross-border raids inside Lebanon since the start of the war last October, Israel Defense Forces (IDF) spokesman Rear Adm. Daniel Hagari said, after the IDF launched what it called a “limited and localized” ...","Oct 1, 2024",2024-10-13 12:31:27.701089,Israel War,Unknown,Middle East,
CNN,https://www.cnn.com/2024/10/01/world/video/israel-launches-incursion-southern-lebanon-ldn-digvid,Israel launches ground incursion in southern Lebanon,"Israel has launched a ground incursion in southern Lebanon in order to target Hezbollah. Israeli officials say there will be no long-term occupation of the country, and that the incursion will be limited in scope.","Oct 1, 2024",2024-10-13 12:31:27.701089,Israel War,Unknown,Middle East,
CNN,https://www.cnn.com/2024/10/01/world/video/iran-missile-israel-attack-white-house-digvid,‘Significant escalation’: Jim Sciutto reacts to WH official’s claim Iran preparing missile attack on Israel,"CNN’s Jim Sciutto reports from Tel Aviv, Israel, as a senior White House official says the US believes Iran is preparing an imminent ballistic missile attack against Israel.","Oct 1, 2024",2024-10-13 12:31:27.701089,Israel War,Unknown,Middle East,
CNN,https://www.cnn.com/2024/10/01/world/video/israel-lebanon-ground-incursion-ovn-ldn-digvid,Video shows Israel and Hezbollah trading strikes amid IDF’s ground operation,CNN’s Paula Hancocks breaks down the latest developments after Israel announced a “limited ground operation” and “targeted raids” in Lebanon.,"Oct 1, 2024",2024-10-13 12:31:27.701089,Israel War,Unknown,Middle East,
CNN,https://www.cnn.com/world/live-news/israel-lebanon-war-hezbollah-09-30-24-intl-hnk/index.html,"September 30, 2024 - news on the Israel-Hezbollah war",The Israeli military says it has begun “a limited ground operation” in southern Lebanon targeting Hezbollah.,"Oct 2, 2024",2024-10-13 12:31:27.701089,Israel War,Lex Harvey,Middle East,
CNN,https://www.cnn.com/2024/09/30/world/video/thomas-friedman-israel-hezbollah-lebanon-ground-operation-digvid,Author: Israel’s three goals after ground operation into Lebanon,Author Thomas Friedman joins CNN’s Anderson Cooper to react to what the IDF says is the start of “a limited ground operation” into Lebanon targeting Hezbollah.,"Oct 1, 2024",2024-10-13 12:31:27.701089,Israel War,Unknown,Middle East,
CNN,https://www.cnn.com/2024/09/30/world/video/israel-limited-ground-operartion-lebanon-fareed-zakaria-ebof-digvid,Fareed Zakaria weighs in on Israel launching a ‘limited ground operation’ in Lebanon,The Israeli military says it began “a limited ground operaition” into Lebanon “against terrorist targets and infrastructures” of Hezbollah. Fareed Zakaria weighs in.,"Oct 1, 2024",2024-10-13 12:31:27.701089,Israel War,Unknown,Middle East,
CNN,https://www.cnn.com/2024/09/30/world/video/israel-idf-artillery-lebanon-diamond-lead-digvid,Hear IDF launch artillery rounds into Lebanon,CNN’s Jeremy Diamond reports from Northern Israel where the IDF is launching artillery rounds into Lebanon.,"Oct 1, 2024",2024-10-13 12:31:27.701089,Israel War,Unknown,Middle East,
CNN,https://www.cnn.com/2024/09/30/world/video/lebanon-israel-ground-incursion-digvid,CNN reporter reacts to potential Israeli incursion in Lebanon,"As satellite images show Israeli military vehicles close to the Lebanon border, CNN’s Ben Wedeman reacts to a possible incursion. The IDF would not comment when asked about whether the vehicles were part of a potential invasion force.","Oct 1, 2024",2024-10-13 12:31:27.701089,Israel War,Nicholas Blatt,Middle East,
CNN,https://www.cnn.com/2024/09/30/world/video/beirut-lebanon-idf-strikes-jomana-karadsheh-pkg-ctw-digvid,Children forced to sleep on the streets as war comes to Lebanon,"CNN’s Jomana Karadsheh reports from the streets of Beirut, where displaced civilians struggle for daily essentials amid tensions between Israel and Lebanon.","Oct 1, 2024",2024-10-13 12:31:27.701089,Israel War,Unknown,Middle East,
CNN,https://www.cnn.com/2024/09/30/Tv/video/amanpour-farah-nabulsi-saleh-bakri-the-teacher,Capturing the 'deeply human story' of Israeli occupation in the West Bank,"Palestinian-British director Farah Nabulsi and actor Saleh Bakri speak to Christiane Amanpour about their film “The Teacher”, portraying the brutal everyday challenges faced by Palestinians in the West Bank.","Sep 30, 2024",2024-10-13 12:31:27.701089,Israel War,Unknown,Middle East,
CNN,https://www.cnn.com/2024/09/30/Tv/video/amanpour-israel-lebanon-war-egyptian-former-foreign-minister-nabil-fahmy,"Israel has tactics, but no strategy, Egypt's former Foreign Minister says",Egypt’s former Foreign Minister Nabil Fahmy talks to Christiane Amanpour about Israel’s attacks in Lebanon.,"Sep 30, 2024",2024-10-13 12:31:27.701089,Israel War,Unknown,Middle East,
CNN,https://www.cnn.com/2024/09/30/world/video/beirut-strike-lebanon-israel-ldn-digvid,CNN at the scene of latest Israeli airstrike in Beirut,CNN Senior International Correspondent Ben Wedeman reports from the scene of the latest Israeli airstrike in the Lebanese capital of Beirut. The Popular Front for the Liberation of Palestine (PFLP) in Lebanon said three of its members were ...,"Sep 30, 2024",2024-10-13 12:31:27.701089,Israel War,Unknown,Middle East,
CNN,https://www.cnn.com/world/live-news/israel-lebanon-war-hezbollah-09-29-24/index.html,"September 29, 2024 - news on the Israel-Hezbollah war","Hezbollah Israel is launching deadly airstrikes on what it says are Hezbollah targets in Lebanon. The bombardment has destroyed homes and infrastructure, displacing an estimated 1 million people. Follow for live news updates.","Oct 2, 2024",2024-10-13 12:31:27.701089,Israel War,Simone McCarthy,Middle East,
CNN,https://www.cnn.com/2024/09/29/world/video/beirut-lebanon-airstrike-israel-hezbollah-digvid,Video shows aftermath of new Israeli strike in Beirut,Videos geolocated by CNN show chaotic scenes on the streets of Beirut following an airstrike within the city limits of the Lebanese capital. CNN’s Nic Robertson reports.,"Sep 30, 2024",2024-10-13 12:31:27.701089,Israel War,Austin Mabeus,Middle East,
CNN,https://www.cnn.com/2024/09/29/world/video/yemen-explosions-israeli-strikes-port-sciutto-digvid,Watch massive explosions as Israel strikes port in Houthi-controlled Yemen,Israel strikes targets including a seaport and power station in Houthi-controlled Yemen after the Iran-backed Houthis launched recent rocket and missile attacks on Israel. CNN’s Jim Sciutto reports.,"Sep 30, 2024",2024-10-13 12:31:27.701089,Israel War,Unknown,Middle East,
CNN,https://www.cnn.com/2024/09/29/world/video/gps0929-assassination-of-hezbollah-leader,On GPS: Implications of Israel’s assassination of Hezbollah leader,"Fareed speaks with New York Times Magazine staff writer Ronen Bergman about how Israel successfully assassinated Hezbollah leader Hassan Nasrallah, whether this could further heighten tensions in the Middle East, and what is next for Israel.","Sep 29, 2024",2024-10-13 12:31:27.701089,Israel War,Fareed Zakaria,Middle East,
CNN,https://www.cnn.com/2024/09/29/world/video/beirut-strikes-civilians-karadsheh-cnntm-digvid,CNN reporter shows how civilians in Beirut are faring,"CNN’s Jomana Karadsheh reports on mass civilian exodus and displacement from the edge of the southern suburbs in Beirut, Lebanon, which has been the focus of Israel Defense Forces (IDF) strikes.","Sep 29, 2024",2024-10-13 12:31:27.701089,Israel War,Jomana Karadsheh,Middle East,
CNN,https://www.cnn.com/2024/09/29/world/video/lebanon-conflict-israel-leighton-elgamal-digvid,‘Limited ground incursion’: Retired colonel explains what this might look like,"Hezbollah leader Hassan Nasrallah’s killing marks a significant escalation in the conflict between Israel and the Lebanon-based militant group, which has been firing on Israel since the start of its war against Hamas in Gaza.","Sep 29, 2024",2024-10-13 12:31:27.701089,Israel War,Unknown,Middle East,
CNN,https://www.cnn.com/world/live-news/israel-lebanon-war-hezbollah-09-28-24/index.html,Hezbollah leader Hassan Nasrallah killed in Israeli strike,"Hezbollah has confirmed the death of its leader Hassan Nasrallah, after Israel said he was killed in its airstrikes on the Lebanese capital of Beirut on Friday. Follow for live news updates.","Oct 5, 2024",2024-10-13 12:31:27.701089,Israel War,Chris Lau,Middle East,
CNN,https://www.cnn.com/2024/09/28/world/video/israel-hezbollah-hassan-nasrallah-nic-robertson-digvid,Nic Robertson on possible successor to Hezbollah chief,"Hassan Nasrallah, killed by an Israeli strike on southern Beirut, turned Hezbollah into one of the most powerful paramilitary forces in the Middle East. CNN International Diplomatic Editor Nic Robertson details who could take over his ...","Sep 29, 2024",2024-10-13 12:31:27.701089,Israel War,Unknown,Middle East,
CNN,https://www.cnn.com/2024/09/28/world/video/beirut-lebanon-blast-jomana-digvid,"Huge blast hits Beirut, CNN team reports what they saw","Another huge explosion has hit the Lebanese capital of Beirut, CNN’s Jomana Karadsheh reports. Smoke can be seen rising from the city’s southern suburbs, where Israel has carried out a series of strikes recently.","Sep 28, 2024",2024-10-13 12:31:27.701089,Israel War,Unknown,Middle East,
CNN,https://www.cnn.com/2024/09/28/world/video/smr-miller-netanyahu-views-conflict-as-opportunity,"Aaron David Miller: Netanyahu views regional conflict as an ""opportunity""",A former State Department Middle East Negotiator tells CNN Michael Smerconish Israeli Prime Minister Benjamin Netanyahu does not want a regional war but views the escalating conflict as an opportunity to stay in power. ,"Sep 28, 2024",2024-10-13 12:31:27.701089,Israel War,Unknown,Middle East,
CNN,https://www.cnn.com/2024/09/28/world/video/smr-david-sanger-netanyahu-defy-us,David Sanger: Netanyahu can defy the United States,"The author of “New Cold Wars: China’s Rise, Russia’s Invasion, and America’s Struggle to Defend the West ” tells CNN Michael Smerconish that Israeli Prime Minister Benjamin Netanyahu is at a unique moment in American politics where ...","Sep 28, 2024",2024-10-13 12:31:27.701089,Israel War,Jorge Mitssunaga,Middle East,
CNN,https://www.cnn.com/2024/09/28/world/video/israel-idf-strategy-finding-hezbollah-hassan-nasrallah-leighton-cnntm-digvid,'Incredible preparation': Retired colonel on how IDF found Hezbollah leader,"Hezbollah has confirmed the death of its leader Hassan Nasrallah, after Israel said he was killed in an airstrike in Beirut, Lebanon on Friday. Retired Colonel Cedric Leighton joins CNN to discuss.","Sep 28, 2024",2024-10-13 12:31:27.701089,Israel War,Unknown,Middle East,
CNN,https://www.cnn.com/2024/09/28/world/video/wedeman-israel-claims-hezbollah-leader-killed-in-beirut-strike-digvid,Wedeman explains Nasrallah's significance for Hezbollah,"The Israeli military claims that Hezbollah leader Hassan Nasrallah was killed in Friday’s airstrike in Beirut, Lebanon. There has been no confirmation from Hezbollah. Nasrallah was one of the founders of Hezbollah, that formed four ...","Sep 28, 2024",2024-10-13 12:31:27.701089,Israel War,Unknown,Middle East,
CNN,https://www.cnn.com/2024/09/28/world/video/israel-idf-strategy-hezbollah-hamas-robertson-nr-digvid,CNN reporter explains difference in IDF strategy against Hamas and Hezbollah,"CNN’s Nic Robertson reports on the Israeli military claims that Hezbollah leader Hassan Nasrallah was killed in an airstrike in Beirut, Lebanon, and looks at why Israel’s strategy against Hezbollah is not the same as the one against Hamas.","Sep 28, 2024",2024-10-13 12:31:27.701089,Israel War,Nic Robertson,Middle East,
CNN,https://www.cnn.com/world/live-news/israel-lebanon-war-hezbollah-09-27-24/index.html,Israel carries out deadly strikes on Lebanon’s capital,Large blasts hit Lebanon’s capital of Beirut after Israeli Prime Minister Benjamin Netanyahu made a combative speech at the UN General Assembly. Follow for live news updates.,"Sep 28, 2024",2024-10-13 12:31:27.701089,Israel War,Lex Harvey,Middle East,
CNN,https://www.cnn.com/2024/09/27/world/video/fareed-zakaria-israel-beirut-strike-iran-reaction-qmb-digvid,Fareed Zakaria has theory on how Iran will react to strike on Beirut,"CNN’s Fareed Zakaria says he expects a muted response from Iran, Hezbollah’s sponsor in the region, after Israeli airstrikes hit buildings in Beirut that it alleges are storing Hezbollah missiles and targeted Hezbollah leader Hassan Nasrallah.","Sep 28, 2024",2024-10-13 12:31:27.701089,Israel War,Fareed Zakaria,Middle East,
CNN,https://www.cnn.com/2024/09/27/world/video/the-lead-beth-sanner-israel-hezbollah-attacks-explosion-beirut-jake-tapper,"CNN analyst on Israel's opportunity to ""decapitate"" Hezbollah leadership",Beth sanner joins The Lead,"Sep 28, 2024",2024-10-13 12:31:27.701089,Israel War,Unknown,Middle East,
CNN,https://www.cnn.com/2024/09/27/world/video/the-lead-barak-ravid-israel-hezbollah-war-explosion-strike-jake-tapper,Middle East expert on why Israel struck Hezbollah now,Barak Ravid joins The Lead,"Sep 28, 2024",2024-10-13 12:31:27.701089,Israel War,Unknown,Middle East,
CNN,https://www.cnn.com/2024/09/27/world/video/israel-hezbollah-strike-beirut,CNN analyst: Israeli sources think Hezbollah leader is likely dead,CNN analyst and Axios reporter Barak Ravid says that his sources in Israel believe that Hezbollah leader Hassan Nasrallah was likely killed in a strike on the group’s headquarters.,"Sep 28, 2024",2024-10-13 12:31:27.701089,Israel War,Unknown,Middle East,
CNN,https://www.cnn.com/2024/09/27/Tv/video/amanpour-gerges,"Strike targeting Nasrallah could trigger all out war, warns analyst","Bianna Golodryga speaks with Fawaz Gerges, Professor of Political Science at the London School of Economics, about the Israeli army’s attack in Beirut.","Sep 27, 2024",2024-10-13 12:31:27.701089,Israel War,Unknown,Middle East,
CNN,https://www.cnn.com/2024/09/27/Tv/video/amanpout-tibon,Israeli journalist on IDF attack in Beirut: This strategy could lead to Hezbollah intensifying its attacks,Bianna Golodryga speaks with Haaretz correspondent Amir Tibon about the Israeli army’s latest attack in Beirut.,"Sep 27, 2024",2024-10-13 12:31:27.701089,Israel War,Unknown,Middle East,
CNN,https://www.cnn.com/2024/09/27/world/video/lebanon-displaced-beirut-digvid,'A second Gaza:' CNN hears from displaced people in Lebanon,"More than 400,000 people have been internally displaced since Israel began striking Lebanon last week, according to the country’s health minister. CNN speaks to some of those displaced by the conflict.","Sep 27, 2024",2024-10-13 12:31:27.701089,Israel War,Unknown,Middle East,
CNN,https://www.cnn.com/2024/09/27/world/video/israel-strikes-hezbollah-headquarters-beirut-lebanon-ip-digvid,Israeli military says it struck Hezbollah headquarters in Lebanon. What we know,"Several big explosions rocked the Lebanese capital of Beirut, CNN teams on the ground witnessed. Israel Defense Forces (IDF) spokesperson Daniel Hagari said in a brief video statement that the Israeli military had struck Hezbollah’s ...","Sep 27, 2024",2024-10-13 12:31:27.701089,Israel War,Jomana Karadsheh,Middle East,
CNN,https://www.cnn.com/2024/09/27/world/video/israel-benjamin-netanyahu-un-speech-marquardt-nr-digvid,CNN reporter breaks down Netanyahu's UN speech,"Israeli Prime Minister Benjamin Netanyahu made a combative speech at the UN General Assembly, saying he wanted to defend Israel against the “lies and slander” he’d heard. CNN’s Alex Marquardt reports.","Sep 27, 2024",2024-10-13 12:31:27.701089,Israel War,Unknown,Middle East,
CNN,https://www.cnn.com/2024/09/27/politics/video/us-defense-secretary-israel-hezbollah-war-ldn-digvid,Defense Secretary Austin says an all-out war would be 'devastating' for both Lebanon and Israel,"In an exclusive interview CNN’s Wolf Blitzer asks US Secretary of Defence Lloyd Austin what he thinks the implications are of a war between Hezbollah and Israel, emphasizing the need for a “diplomatic solution” in the escalating conflict.","Sep 27, 2024",2024-10-13 12:31:27.701089,Israel War,Unknown,Middle East,
CNN,https://www.cnn.com/world/live-news/israel-lebanon-war-hezbollah-09-26-24-intl-hnk/index.html,"September 26, 2024 Middle East conflict news","Israel carried out strikes in the southern suburbs of Beirut, which it said killed a Hezbollah commander, as the US and allies call for a 21-day ceasefire. Follow for live news updates.","Sep 27, 2024",2024-10-13 12:31:27.701089,Israel War,Kathleen Magramo,Middle East,
CNN,https://www.cnn.com/2024/09/26/world/video/firass-abiad-lebanon-israel-karadsheh-intv-digvid,Lebanese health minister: I think we are in a full-fledged war,"Lebanon’s health minister, Dr. Firass Abiad, speaks to CNN’s Jomana Karadsheh about Israel’s strikes against Hezbollah in Lebanon.","Sep 27, 2024",2024-10-13 12:31:27.701089,Israel War,Unknown,Middle East,
CNN,https://www.cnn.com/2024/09/26/world/video/air-strike-gaza-families-suffer-loss-hancocks-pkg-digvid,"'Born together, and killed together': Families suffer through daily air strikes in Gaza","As attention shifts to the rapidly escalating situation along the Israeli-Lebanese border, families in Gaza are still living through the fear and terror of daily air strikes. CNN’s Paula Hancocks reports. ","Sep 26, 2024",2024-10-13 12:31:27.701089,Israel War,Paula Hancocks,Middle East,
CNN,https://www.cnn.com/2024/09/26/Tv/video/amanpour-iran-javad-zarif,"Amanpour questions Iran's new VP on women's rights, hostages and regional war","Christiane Amanpour asks Javad Zarif, Iran’s Vice President for Strategic Affairs, about women’s rights, hostages, and if Iran will be pulled into a regional war.","Sep 26, 2024",2024-10-13 12:31:27.701089,Israel War,Unknown,Middle East,
CNN,https://www.cnn.com/2024/09/26/world/video/israel-lebanon-hezbollah-ceasefire-digvid,"‘Nowhere near a truce’: Nic Robertson on possible Hezbollah, Israel ceasefire","A diplomatic push is underway to prevent a regional war from erupting in the Middle East, with the US and its allies calling for a 21-day ceasefire across the Israel-Lebanon border. CNN’s International Diplomatic Editor Nic Robertson ...","Sep 26, 2024",2024-10-13 12:31:27.701089,Israel War,Unknown,Middle East,
CNN,https://www.cnn.com/world/live-news/israel-lebanon-war-hezbollah-09-25-24/index.html,Hezbollah fires at Tel Aviv as Israel bombards Lebanon,"Israel and Hezbollah are trading waves of strikes as their conflict escalates, forcing thousands in Lebanon to flee their homes.","Sep 26, 2024",2024-10-13 12:31:27.701089,Israel War,Antoinette Radford,Middle East,
CNN,https://www.cnn.com/2024/09/25/world/video/tel-aviv-beirut-israel-lebanon-digvid,CNN reporters in Beirut and Tel Aviv explain state of play after Israel intercepts Hezbollah missile,"A missile intercepted near Tel Aviv, Israel, is the first fired by the militant group Hezbollah to reach close to the city, the Israeli military said. CNN’s Nic Robertson reports from Tel Aviv, Israel, in conversation with Tamara Qiblawi in Beirut, ...","Sep 26, 2024",2024-10-13 12:31:27.701089,Israel War,Nicholas Blatt,Middle East,
CNN,https://www.cnn.com/2024/09/25/Tv/video/amanpour-greece-kyriakos-mitsotakis-israel-parthenon,Greek Prime Minister: We are friends with Israel and need to tell them hard truths,"Kyriakos Mitsotakis, Prime Minister of Greece, speaks with Christiane Amanpour about migration, the Middle East, and the possible return of the Parthenon sculptures.","Sep 25, 2024",2024-10-13 12:31:27.701089,Israel War,Ben Kirby,Middle East,
CNN,https://www.cnn.com/world/live-news/israel-lebanon-hezbollah-09-24-24-intl-hnk/index.html,September 24 Israel-Lebanon news,"Israeli airstrikes targeting militant group Hezbollah in Lebanon killed nearly 500 people and wounded 1,600 others on Monday — the deadliest day in the country in nearly two decades.","Sep 25, 2024",2024-10-13 12:31:27.701089,Israel War,Kathleen Magramo,Middle East,
CNN,https://www.cnn.com/2024/09/25/world/video/lebanon-beirut-shelter-ldn-digvid,Hear from Lebanese civilians sheltering in Beirut,"As Israel’s airstrike campaign continues in Lebanon, people who have been forced to flee the southern part of the country have taken shelter inside schools in Beirut.","Sep 25, 2024",2024-10-13 12:31:27.701089,Israel War,Unknown,Middle East,
CNN,https://www.cnn.com/2024/09/25/world/video/tel-aviv-missile-intercept-israel-digvid,Video shows ballistic missile from Lebanon reaching near Tel Aviv before being intercepted,"The Israeli military said it intercepted a missile from Lebanon near Israel’s economic center Tel Aviv. No missiles fired by Hezbollah toward Israel have reached as far south as Tel Aviv during the latest escalation of tensions, nor in ...","Sep 25, 2024",2024-10-13 12:31:27.701089,Israel War,Unknown,Middle East,
