Source,Link,Headline,Description,Date,Timestamp,Topic,Author,Region,Article_Content
CNN,https://www.cnn.com/2024/09/24/world/video/the-lead-dan-crenshaw-israel-attacks-lebanon-netanyahu-hezbollah-russia-ukraine-johnson-jake-tapper,House Intel member on Israel's strikes against Hezbollah,Rep. Dan Crenshaw joins The Lead,"Sep 25, 2024",2024-10-13 12:31:27.701089,Israel War,Unknown,Middle East,
CNN,https://www.cnn.com/2024/09/24/Tv/video/amanpour-bulos,"‘No one here is expecting U.S. to play a major role in stopping the hostilities,’ says journalist","Christiane Amanpour speaks with Nabih Bulos, the Middle East Bureau Chief for the Los Angeles Times about the escalation between Israel and Hezbollah.","Sep 24, 2024",2024-10-13 12:31:27.701089,Israel War,Unknown,Middle East,
CNN,https://www.cnn.com/2024/09/24/world/video/iranian-president-pezeshkian-hezbollah-zakaria-ldn-digvid,"Iran, Hezbollah's sponsor, reacts to Israel's strikes on the militant group",Iran’s President Masoud Pezeshkian sat down with CNN’s Fareed Zakaria to discuss the latest escalations between Hezbollah and Israel. See more of Zakaria’s interview with Pezeshkian this Sunday at 10am/1pm ET on CNN and at ...,"Sep 24, 2024",2024-10-13 12:31:27.701089,Israel War,Unknown,Middle East,
CNN,https://www.cnn.com/world/live-news/israel-lebanon-hezbollah-09-23-24-intl-hnk/index.html,Israeli strikes targeting Hezbollah kill hundreds across Lebanon,"The Israeli military said Monday it was “conducting extensive strikes” on Hezbollah targets in Lebanon. Israel and Hezbollah exchanged waves of strikes over the weekend, with the militant group striking deeper than they have done in recent ...","Sep 24, 2024",2024-10-13 12:31:27.701089,Israel War,Antoinette Radford,Middle East,
CNN,https://www.cnn.com/2024/09/24/world/video/leon-panetta-lebanon-israel-hezbollah-deaths-civillian-attacks-jake-tapper-lead-digvid,Ex-CIA chief reflects on past Mideast wars as he predicts how current conflict might end. Hear what he told Jake Tapper,"Former US Defense Secretary and ex-CIA chief Leon Panetta joins CNN’s Jake Tapper to discuss the Israel-Hezbollah conflict after more than 450 people were killed and 1,600 others were injured in Israeli airstrikes in Lebanon.","Sep 24, 2024",2024-10-13 12:31:27.701089,Israel War,Unknown,Middle East,
CNN,https://www.cnn.com/2024/09/23/world/video/the-lead-naftali-bennett-israel-hezbollah-lebanon-attacks-death-hamas-jake-tapper,"Former Israeli PM to Lebanese people: ""Topple"" Hezbollah",Naftali Bennett joins The Lead,"Sep 24, 2024",2024-10-13 12:31:27.701089,Israel War,Unknown,Middle East,
CNN,https://www.cnn.com/2024/09/23/world/video/israel-lebanon-airstrikes-diamond-pkg-lead-digvid,Video shows Israeli airstrikes battering Lebanon,"More than 450 people were killed and 1,600 others were injured in Israeli airstrikes in Lebanon on Monday, officials said, marking the deadliest day of strikes from Israel in the country since the 2006 war. CNN’s Jeremy Diamond reports on the ...","Sep 24, 2024",2024-10-13 12:31:27.701089,Israel War,Unknown,Middle East,
CNN,https://www.cnn.com/2024/09/23/Tv/video/amanpour-harris,"‘We're seeing blatant disregard of international law’ by Israel, says Irish PM",Christiane Amanpour speaks with Irish PM Simon Harris on the sidelines of the UN General Assembly on the violence in the Middle East.,"Sep 23, 2024",2024-10-13 12:31:27.701089,Israel War,Unknown,Middle East,
CNN,https://www.cnn.com/2024/09/23/world/video/israel-lebanon-airstrikes-war-wedeman-cnc-digvid,'Lebanon caught in the middle': Ben Wedeman shares insights on the ongoing conflict,"Lebanese health officials have reported over 100 deaths and 400 injuries due to intensified Israeli airstrikes, escalating the conflict with Hezbollah. Approximately 300 strikes have prompted mass evacuations and school closures, causing ...","Sep 23, 2024",2024-10-13 12:31:27.701089,Israel War,Unknown,Middle East,
CNN,https://www.cnn.com/world/live-news/israel-lebanon-attacks-09-22-24/index.html,Israel-Hezbollah attacks escalate,Israel killed a senior Hezbollah commander and other leaders in a strike on southern Beirut. It comes after deadly pager and walkie-talkie attacks this week.,"Sep 23, 2024",2024-10-13 12:31:27.701089,Israel War,Lex Harvey,Middle East,
CNN,https://www.cnn.com/2024/09/22/world/video/israel-hezbollah-attacks-beirut-former-cia-baer-nr-digvid,Former CIA officer reacts to pager explosions and escalating tensions in Middle East,"Former CIA officer Robert Baer discusses how tensions between Israel and Hezbollah have escalated since hundreds of pagers exploded almost simultaneously across Lebanon, killing multiple people and injuring thousands.","Sep 23, 2024",2024-10-13 12:31:27.701089,Israel War,Unknown,Middle East,
CNN,https://www.cnn.com/2024/09/22/politics/video/sotu-cotton-israel-has-every-right-to-go-after-hezbollah,Sen. Cotton: ‘Israel has every right’ to go after Hezbollah in Lebanon,Republican Sen. Tom Cotton joins CNN’s Jake Tapper to discuss the latest tensions between Israel and Hezbollah.,"Sep 22, 2024",2024-10-13 12:31:27.701089,Israel War,Jake Tapper,Middle East,
CNN,https://www.cnn.com/2024/09/22/world/video/hezbollah-lebanon-projectiles-israel-wedeman-cnntm-digvid,Hezbollah fires more than 100 projectiles into Israel after IDF strikes. Hear the details,Israel’s military said more than 100 projectiles were fired overnight from Lebanon into Israel. This comes after Israel carried out some of its most intense strikes on Lebanon against Hezbollah since the October 7 attacks. CNN’s Ben Wedeman ...,"Sep 22, 2024",2024-10-13 12:31:27.701089,Israel War,Ben Wedeman,Middle East,
CNN,https://www.cnn.com/2024/09/21/world/video/hezbollah-israeli-strike-beirut-wedeman-dnt-digvid,Hear how civilians are reacting to strike on Beirut,"At least 38 people were killed, including high-level commanders of Hezbollah, in an Israeli strike on southern Beirut. CNN’s Ben Wedeman reports on the blow to Hezbollah and how civilians are responding to the attacks. ","Sep 22, 2024",2024-10-13 12:31:27.701089,Israel War,Unknown,Middle East,
CNN,https://www.cnn.com/2024/09/21/world/video/hezbollah-attack-difficulty-israel-lebanon-border-commanders-pittard-nr-digvid,"Retired US general: Hezbollah has resources, but here’s where the difficulty is for them",Retired US army Maj. General Dana Pittard explains what Hezbollah’s military strike capability may be as Israel prepares for retaliation.,"Sep 22, 2024",2024-10-13 12:31:27.701089,Israel War,Unknown,Middle East,
CNN,https://www.cnn.com/world/live-news/israel-lebanon-attacks-09-21-24/index.html,"September 21, 2024 - Israel-Hezbollah conflict",Israel killed a senior Hezbollah commander and other leaders in a strike on southern Beirut Friday. It comes after deadly pager and walkie-talkie attacks this week.,"Sep 22, 2024",2024-10-13 12:31:27.701089,Israel War,Sophie Tanno,Middle East,
CNN,https://www.cnn.com/2024/09/21/world/video/israel-hezbollah-lebanon-border-wedeman-digvid,Videos show Israel and Hezbollah exchange fire across Lebanon border, Israel has carried out some of its most intense strikes on Lebanon since Hezbollah began firing rockets into northern Israel last year following the October 7 attacks. Israel said it struck thousands of launchers Saturday. CNN’s Ben Wedeman ...,"Sep 21, 2024",2024-10-13 12:31:27.701089,Israel War,Unknown,Middle East,
CNN,https://www.cnn.com/2024/09/21/world/video/cnn-smr-israel-invasion-us-elections,How Israel's invasion may impact U.S. Elections,"CNN’s Michael Smerconish discusses the mounting global threats facing the United States with former White House Counterterrorism coordinator Richard Clarke. As Americans begin to cast their ballots in the 2024 presidential election, ...","Sep 21, 2024",2024-10-13 12:31:27.701089,Israel War,Unknown,Middle East,
CNN,https://www.cnn.com/world/live-news/lebanon-explosions-hezbollah-israel-09-20-24-intl-hnk/index.html,Hezbollah confirms top commander killed after Israeli airstrike in Beirut,Hezbollah has confirmed that senior commander Ibrahim Aqil was killed on Friday. Israel said Aqil was among senior Hezbollah figures who were killed in an airstrike on a residential building in Beirut.,"Sep 21, 2024",2024-10-13 12:31:27.701089,Israel War,Kathleen Magramo,Middle East,
CNN,https://www.cnn.com/2024/09/20/world/video/israeli-hostage-killed-sisters-interview-digvid,Sisters of slain Israeli hostage: ‘They starved her before they murdered her’,"On August 30th, the Israeli troops discovered six hostages murdered by Hamas terrorists inside a tunnel in Gaza, including 24-year-old Eden Yerushalmi. Her two sisters, Shani and May, describe the horrific conditions the group lived in for ...","Sep 21, 2024",2024-10-13 12:31:27.701089,Israel War,Abby Washer,Middle East,
CNN,https://www.cnn.com/2024/09/20/world/video/southern-beirut-israel-warplane-airstrike-hezbollah-senior-official-digvid,Video shows aftermath of Israel's strike in Beirut,"Video shows the destruction of buildings and cars in southern Beirut, Lebanon, after the Israel Defense Forces reported carrying out what it called a “targeted” strike. ","Sep 20, 2024",2024-10-13 12:31:27.701089,Israel War,Unknown,Middle East,
CNN,https://www.cnn.com/2024/09/20/world/video/idf-soldiers-throwing-bodies-west-bank-digvid,Video shows Israeli soldiers throwing bodies off roof in occupied West Bank,"The Israeli military is investigating soldiers for throwing bodies from a rooftop in the northern occupied West Bank on Thursday, amid an IDF incursion in the area that left seven dead has seen clashes and intense gunfire with militants. ","Sep 20, 2024",2024-10-13 12:31:27.701089,Israel War,Unknown,Middle East,
CNN,https://www.cnn.com/2024/09/20/world/video/lebanon-israel-wedeman-pkg-092012aseg1-cnni-world-fast,Hezbollah leader vows revenge in aftermath of pager and walkie-talkie blasts,Israel strikes Hezbollah targets in the aftermath of the pager and walk-talkie blasts. Hezbollah’s leader is vowing revenge. CNN’s Ben Wedeman reports from Beirut. ,"Sep 20, 2024",2024-10-13 12:31:27.701089,Israel War,Unknown,Middle East,
CNN,https://www.cnn.com/world/live-news/lebanon-explosions-hezbollah-israel-09-19-24-intl-hnk/index.html,Lebanon rocked by deadly walkie-talkie and pager attacks,Lebanon has been stunned by a wave of deadly attacks caused by exploding pagers and walkie-talkies over two days blamed on Israel. Follow the latest news here.,"Sep 20, 2024",2024-10-13 12:31:27.701089,Israel War,Kathleen Magramo,Middle East,
CNN,https://www.cnn.com/2024/09/19/world/video/the-lead-israel-hostages-gaza-palestine-netanyahu-ceasefire-hamas-war-jake-tapper,U.S. hostage families warn against Middle East escalation,Families of Hamas hostages join The Lead,"Sep 20, 2024",2024-10-13 12:31:27.701089,Israel War,Unknown,Middle East,
CNN,https://www.cnn.com/2024/09/19/world/video/american-hostages-gaza-hamas-israel-tapper-intv-lead-digvid,"His son is being held hostage by Hamas, hear his message to Biden",CNN’s Jake Tapper speaks to five families of American hostages being held by Hamas. ,"Sep 20, 2024",2024-10-13 12:31:27.701089,Israel War,Unknown,Middle East,
CNN,https://www.cnn.com/2024/09/19/world/video/beirut-lebanon-israeli-jets-wedeman-live-shot-digvid,See the moment Israeli jets fly over Beirut while CNN reporter is on air,"CNN Senior International Correspondent Ben Wedeman reacts to Israeli jets flying over Beirut, Lebanon, as Hezbollah Secretary General Hassan Nasrallah delivered an address in response to a wave of explosions across the country.","Sep 19, 2024",2024-10-13 12:31:27.701089,Israel War,Unknown,Middle East,
CNN,https://www.cnn.com/2024/09/19/world/video/lebanon-attacks-injuries-digvid,Doctor describes injuries he’s treating after wave of deadly attacks in Lebanon,CNN’s Ben Wedeman speaks to a surgeon about the injuries he’s treating following a wave of device explosions in Lebanon.,"Sep 19, 2024",2024-10-13 12:31:27.701089,Israel War,Unknown,Middle East,
CNN,https://www.cnn.com/2024/09/18/politics/video/israels-history-of-audacious-assassinations-and-secret-ops,Israel's history of brazen clandestine missions,Israel’s legendary Mossad agency has a history of audacious and dangerous secret operations against foreign adversaries - as well as some misfires.,"Sep 19, 2024",2024-10-13 12:31:27.701089,Israel War,Brian Todd,Middle East,
CNN,https://www.cnn.com/2024/09/18/world/video/lebanese-foreign-minister-pagers-walkie-talkies-amanpour-sot-digvid,'We are afraid': Lebanese foreign minister reacts to wave of explosions across country,CNN’s Christiane Amanpour speaks to Lebanese Foreign Minister Abdallah Bou Habib as the country deals with a fresh wave of explosions one day after pager blasts killed at least 12 people.,"Sep 18, 2024",2024-10-13 12:31:27.701089,Israel War,Unknown,Middle East,
CNN,https://www.cnn.com/2024/09/18/Tv/video/amanpour-bou-habib-israel-lebanon-hezbollah-pagers,"'This will end up with a regional war,' warns Lebanese Foreign Minister","After a second day of explosions target Hezbollah in Lebanon, Christiane Amanpour speaks with Abdallah Bou Habib about risk of war with Israel","Sep 19, 2024",2024-10-13 12:31:27.701089,Israel War,Unknown,Middle East,
CNN,https://www.cnn.com/2024/09/18/Tv/video/amanpour-zur,"Israel and Hezbollah both failing to think strategically, says former IDF general","Christiane Amanpour speaks with Guy Zur, a retired Major General in the Israeli army, about the growing tensions between Israel and Hezbollah.","Sep 18, 2024",2024-10-13 12:31:27.701089,Israel War,Unknown,Middle East,
CNN,https://www.cnn.com/2024/09/18/world/video/more-explosions-lebanon-digvid,Wedeman reports from Lebanon on what we know about walkie-talkie explosions,"There are reports of more explosions in Lebanon, a day after pager blasts across the country killed at least 12 people, including two children, and injured about 2,800 in an attack that targeted militant group Hezbollah. ","Sep 18, 2024",2024-10-13 12:31:27.701089,Israel War,Unknown,Middle East,
CNN,https://www.cnn.com/2024/09/18/Tv/video/amanpour-kim-ghattas-hezbollah-pagers,'Absolute chaos and mayhem' after Hezbollah pagers explode,"After Hezbollah pagers explode, killing at least 9 and injuring thousands, journalist Kim Ghattas tells Christiane Amanpour that “at some point, Israel will go too far.”","Sep 18, 2024",2024-10-13 12:31:27.701089,Israel War,Ben Kirby,Middle East,
CNN,https://www.cnn.com/world/live-news/lebanon-pagers-attack-hezbollah/index.html,"September 17, 2024 - Hezbollah vows retaliation against Israel for deadly pager explosions","At least nine people were killed and around 2,800 wounded in Lebanon in an attack targeting the pagers of Hezbollah members, the Lebanese health minister said.","Sep 18, 2024",2024-10-13 12:31:27.701089,Israel War,Christian Edwards,Middle East,
CNN,https://www.cnn.com/2024/09/17/world/video/gaza-displaced-children-ldn-digvid,Hear from children living in makeshift homes on the shores of Gaza,Gazans camped by the shore to the west of the city of Khan Younis have had to either move their makeshift homes to safer areas or come up with new ways to withstand the rising tides and winds.,"Sep 17, 2024",2024-10-13 12:31:27.701089,Israel War,Unknown,Middle East,
CNN,https://www.cnn.com/2024/09/15/world/video/houthi-fired-missile-attack-central-israel-robertson-digvid,CNN reports from scene of Houthi-fired missile attack,CNN’s International Diplomatic Editor Nic Robertson reports from the ground in central Israel as emergency services tried to put fires caused by a Houthi-fired missile attack. ,"Sep 15, 2024",2024-10-13 12:31:27.701089,Israel War,Unknown,Middle East,
CNN,https://www.cnn.com/2024/09/13/homepage/video/cnn-reporter-rare-access-israel-hamas-ceasefire-digvid,CNN reporter gets rare access to strip of land key to Israel-Hamas ceasefire,"CNN’s Chief Global Affairs Correspondent Matthew Chance got rare access to the Philadelphi Corridor, the strip of land linking Gaza and Egypt, which Netanyahu has insisted must go to Israel in the event of any ceasefire deal. CNN reported from ...","Sep 13, 2024",2024-10-13 12:31:27.701089,Israel War,Unknown,Middle East,
CNN,https://www.cnn.com/2024/09/11/world/video/netanyahu-israel-hostage-family-exchange-robertson-digvid,Hear leaked audio confrontation between Netanyahu and hostage family,A leaked audio recording of a heated exchange between Prime Minister Benjamin Netanyahu and the family of a hostage killed by Hamas is sparking reaction in Israel. CNN’s Nic Robertson reports. ,"Sep 12, 2024",2024-10-13 12:31:27.701089,Israel War,Unknown,Middle East,
CNN,https://www.cnn.com/2024/09/11/Tv/video/yair-golan-israel-labor-leader-netanyahu,"'I'm ready to lead,' Israeli Democrats Party leader offers alternative to Netanyahu","Yair Golan, Israeli Democrats Party Leader, talks to Bianna Golodryga about the protests against Prime Minister Benjamin Netanyahu for not bringing the hostages home.","Sep 11, 2024",2024-10-13 12:31:27.701089,Israel War,Unknown,Middle East,
CNN,https://www.cnn.com/2024/09/10/world/video/idf-tunnel-hostages-killed-digvid,IDF releases video of Gaza tunnel where it says hostages were killed,The Israeli military’s chief spokesperson has shown the interior of the Gaza tunnel where six hostages were held in “horrific conditions” before they were murdered. Their bodies were retrieved by Israeli forces on Sept 1.,"Sep 11, 2024",2024-10-13 12:31:27.701089,Israel War,Unknown,Middle East,
CNN,https://www.cnn.com/world/live-news/israel-gaza-al-mawasi-strike-09-10-24/index.html,"Israeli strike on Gaza humanitarian zone kills and injures dozens, officials say","At least 19 bodies have arrived at hospitals from the designated humanitarian safe zone in Al-Mawasi, southern Gaza, that was hit by an Israeli strike overnight.","Sep 11, 2024",2024-10-13 12:31:27.701089,Israel War,Antoinette Radford,Middle East,
CNN,https://www.cnn.com/2024/09/10/world/video/gaza-humanitarian-zone-strike-chance-pkg-digvid,'They told us this area was safe': Israeli-designated humanitarian safe zone in Gaza targeted by strike,A strike on an Israeli-designated humanitarian safe zone in southern Gaza has killed and injured dozens of Palestinians overnight. CNN’s Matthew Chance reports. ,"Sep 11, 2024",2024-10-13 12:31:27.701089,Israel War,Unknown,Middle East,
CNN,https://www.cnn.com/2024/09/10/world/video/israeli-strikes-gaza-humanitarian-zone-digvid,Video shows desperate search for survivors amidst rubble in Gaza,"At least 40 people were killed in an overnight Israeli airstrike in southern Gaza, which is supposed to be a humanitarian zone for displaced civilians. Israel says the strike was aimed at Hamas leaders in the area. CNN’s Paula Hancock reports.","Sep 10, 2024",2024-10-13 12:31:27.701089,Israel War,Unknown,Middle East,
CNN,https://www.cnn.com/2024/09/08/world/video/gps-0908-a-new-vision-for-peace-in-the-middle-east,On GPS: A joint vision for peace in the Middle East,Former Israeli prime minister Ehud Olmert and former Palestinian Authority foreign minister Nasser al-Kidwa talk to Fareed about their joint vision for a long-lasting peace in the Middle East.,"Sep 8, 2024",2024-10-13 12:31:27.701089,Israel War,Fareed Zakaria,Middle East,
CNN,https://www.cnn.com/2024/09/08/world/video/chance-lklv-090812a-seg1-cnni-world-fastfast-clips-sept-8,Growing anger in Israel over hostages held by Hamas,CNN’s Matthew Chance reports from Tel Aviv where protesters are demanding Israel reach a hostage and ceasefire deal.,"Sep 8, 2024",2024-10-13 12:31:27.701089,Israel War,Matthew Chance,Middle East,
CNN,https://www.cnn.com/2024/09/06/world/video/the-lead-west-bank-gaza-palestine-idf-israel-jake-tapper,"American activist shot dead by Israeli forces at West Bank protest, eyewitnesses say","A young Turkish-American woman, Aysenur Eygi, was shot and killed in the Israeli-occupied West Bank on Friday, according to US and Palestinian officials, while she was taking part in a protest near Nablus. CNN’s Nick Robertson joins The Lead.","Sep 7, 2024",2024-10-13 12:31:27.701089,Israel War,Unknown,Middle East,
CNN,https://www.cnn.com/2024/09/06/us/video/the-lead-antisemitism-israel-hamas-palestine-gaza-war-ekection-2024-jake-tapper,How VP candidates are addressing the Israel-Hamas war,Josh Kraushaar joins The Lead,"Sep 7, 2024",2024-10-13 12:31:27.701089,Israel War,Unknown,Middle East,
CNN,https://www.cnn.com/2024/09/06/world/video/jenin-west-bank-idf-ldn-digvid,CNN looks at damage left behind in Jenin by IDF,"CNN International Diplomatic Editor, Nic Robertson, goes inside Jenin in the occupied West Bank to see the destruction left behind by the Israeli military after they withdrew following a lengthy operation.","Sep 6, 2024",2024-10-13 12:31:27.701089,Israel War,Unknown,Middle East,
CNN,https://www.cnn.com/2024/09/04/world/video/benjamin-netanyahu-israel-gaza-civilian-casualties-diamond-digvid,Netanyahu says he won’t change Israel's policies in Gaza,"Responding to a question from CNN’s Jeremy Diamond about civilian deaths in Gaza, Israeli Prime Minister Benjamin Netanyahu defends the IDF’s conduct in Gaza and says he won’t change his “humanitarian policies, vaccination policies ...","Sep 5, 2024",2024-10-13 12:31:27.701089,Israel War,Jeremy Diamond,Middle East,
CNN,https://www.cnn.com/2024/09/03/Tv/video/amanpour-bergman,"Israeli security officials fear West Bank is on the brink of third intifada, says journalist","Bianna Golodryga speaks with Ronen Bergman, Staff Writer at The New York Times Magazine, on the killing of six Israeli hostages and the uptick in violence in the West Bank.","Sep 3, 2024",2024-10-13 12:31:27.701089,Israel War,Ami Kaufman,Middle East,
CNN,https://www.cnn.com/2024/09/03/Tv/video/amanpour-gonen,"'We are letting them die there,' says mother of Israeli hostage","Bianna Golodryga speaks with Meirav Leshem Gonen, mother of Romi, who was kidnapped by Hamas on October 7th and is still being held in Gaza.","Sep 3, 2024",2024-10-13 12:31:27.701089,Israel War,Unknown,Middle East,
CNN,https://www.cnn.com/2024/09/02/world/video/gaza-polio-vaccinations-arwa-damon-intv-tsr-digvid,'Pure survival under inhumane conditions': INARA founder explains dire situation in Gaza,CNN’s Alex Marquardt talks with INARA founder Arwa Damon about the conditions in Gaza and the challenges faced in attempts to administer polio vaccinations to the children.,"Sep 3, 2024",2024-10-13 12:31:27.701089,Israel War,Unknown,Middle East,
CNN,https://www.cnn.com/2024/09/02/world/video/the-lead-israel-palestine-hostages-hamas-war-oct-7,Netanyahu under pressure after hostage deaths,Alon Pinkas joins The Lead,"Sep 3, 2024",2024-10-13 12:31:27.701089,Israel War,Unknown,Middle East,
CNN,https://www.cnn.com/2024/09/02/world/video/protesters-israel-ceasefire-hostages-diamond-pkg-digvid,Protesters flood Israel’s streets to demand ceasefire,"Hundreds of thousands of protesters took to Israel’s streets for a second consecutive day, organizers said, as the country was brought to a near-halt by a general strike over anger at the government’s failure to secure a ...","Sep 3, 2024",2024-10-13 12:31:27.701089,Israel War,Jeremy Diamond,Middle East,
CNN,https://www.cnn.com/2024/09/02/world/video/netanyahu-remarks-hostages-killed-protests-cnc-digvid,Netanyahu speaks after hostages found dead in Gaza,"Prime Minister Benjamin Netanyahu delivers remarks after six hostages’ bodies were found in Gaza this weekend, sparking massive protests in Israel.","Sep 2, 2024",2024-10-13 12:31:27.701089,Israel War,Unknown,Middle East,
CNN,https://www.cnn.com/2024/09/02/world/video/israeli-president-herzog-apology-hersh-goldberg-polin-funeral-bts-nr-digvid,Hear Israeli president's apology to family of killed hostage Hersh Goldberg-Polin at his funeral,Israeli President Isaac Herzog asked the family of American-Israeli hostage Hersh Goldberg-Polin for forgiveness for “failing” to bring him home alive. ,"Sep 2, 2024",2024-10-13 12:31:27.701089,Israel War,Unknown,Middle East,
CNN,https://www.cnn.com/2024/09/01/world/video/israeli-hostages-killed-gaza-robertson-digvid,Remembering the six Israeli hostages killed in Gaza,Anger is mounting across Israel over the deaths of six hostages killed inside Gaza. CNN’s Nic Robertson reports.,"Sep 2, 2024",2024-10-13 12:31:27.701089,Israel War,Unknown,Middle East,
CNN,https://www.cnn.com/2024/09/01/world/video/israel-tel-aviv-protest-hamas-hostages-robertson-nr-digvid,See what it looks like in middle of Tel Aviv protests sparked by death of hostages,"CNN’s Nic Robertson reports from within a protest in Tel Aviv calling for an immediate ceasefire, as anger grows toward Prime Minister Benjamin Netanyahu over his failure to secure the release of hostages after Israel’s military recovered ...","Sep 2, 2024",2024-10-13 12:31:27.701089,Israel War,Nic Robertson,Middle East,
CNN,https://www.cnn.com/2024/09/01/world/video/protests-israel-hostage-deaths-netanyahu-digvid,'One of the most devastating days of the last 11 months': Protesters demonstrate over hostage deaths,Protesters in Israel call for an immediate ceasefire as anger grows toward Prime Minister Benjamin Netanyahu over his failure to secure the release of hostages after Israel’s military recovered the bodies of six hostages it said Hamas had ...,"Sep 1, 2024",2024-10-13 12:31:27.701089,Israel War,Unknown,Middle East,
CNN,https://www.cnn.com/2024/09/01/world/video/hamas-hostage-parents-netanyahu-message-sot-sotu-digvid,Parents of hostage held by Hamas send message to Netanyahu,Parents of Israeli-American hostage Omer Neutra speak to CNN’s Dana Bash as anger mounts against Netanyahu for failing to bring the hostages home. ,"Sep 1, 2024",2024-10-13 12:31:27.701089,Israel War,Unknown,Middle East,
