Source,Link,Headline,Description,Date,Timestamp,Topic,Author,Region,Article_Content
CNN,https://www.cnn.com/2024/07/10/business/china-eu-probe-trade-barriers-intl-hnk/index.html,China examining if EU is putting up ‘trade barriers’ as tensions intensify,The Chinese government said Wednesday that it would investigate whether the European Union’s probes into Chinese companies constitute “trade barriers.”,"Jul 10, 2024",2024-10-15,China News,-,China,-
CNN,https://www.cnn.com/2024/07/09/travel/biggest-indoor-snow-and-ice-park-harbin-china-intl-hnk/index.html,World’s biggest indoor snow and ice park opens in China,"The world’s largest indoor ice and snow theme park has opened its doors to the public, giving visitors to the city of Harbin in northeast China a chance to feel wintery temperatures year-round.","Jul 10, 2024",2024-10-15,China News,-,China,-
CNN,https://www.cnn.com/2024/07/09/business/china-ev-byd-turkey-plant-intl-hnk/index.html,Chinese EV giant BYD to build $1 billion plant in Turkey,"China’s BYD, which vies with Tesla for the title of the world’s top maker of battery electric vehicles, has agreed to build a $1 billion car factory in Turkey, the Turkish government has announced.","Jul 9, 2024",2024-10-15,China News,-,China,-
CNN,https://www.cnn.com/2024/07/08/business/china-eu-brandy-import-probe-intl-hnk/index.html,Beijing steps up probe into EU brandy imports as trade tensions deepen after tariffs on Chinese EVs,Beijing has intensified its anti-dumping investigation into imports of European brandy.,"Jul 8, 2024",2024-10-15,China News,-,China,-
CNN,https://www.cnn.com/2024/07/08/china/china-maths-student-controversy-hnk-intl/index.html,Rural Chinese student sparks awe and suspicion after beating math elites in global contest,A fashion major from a vocational high school in rural China has amazed the nation by outshining elite students in a global math contest – but the teenager’s underdog story has now been mired in allegations that she cheated.,"Jul 8, 2024",2024-10-15,China News,-,China,-
CNN,https://www.cnn.com/2024/07/08/asia/china-monster-coast-guard-ship-philippines-intl-hnk-ml/index.html,What is China’s ‘monster’ coast guard ship and why is the Philippines spooked by it?,China anchored one of its two “monster” coast guard ships inside the Philippines’ EEZ last week in what a Philippine official called an act of “intimidation.”,"Jul 8, 2024",2024-10-15,China News,-,China,-
CNN,https://www.cnn.com/2024/07/06/china/china-shandong-tornado-dead-injured-intl/index.html,Tornado leaves 5 dead and dozens injured in eastern China,"Five people were killed and nearly 100 injured when a tornado ripped through a town in eastern China, according to the state-run Xinhua news agency.","Jul 7, 2024",2024-10-15,China News,-,China,-
CNN,https://www.cnn.com/2024/07/06/world/video/tornado-china-shandong-ldn-digvid,Deadly tornado rips through China's east,"Dramatic video shows a tornado sending debris into the air in China’s Shandong province on Friday. At least five people have died and at least 88 more have been injured, according to authorities.","Jul 8, 2024",2024-10-15,China News,-,China,-
CNN,https://www.cnn.com/2024/07/05/world/video/china-defense-ministers-xi-jinping-ripley-dnt-ebof-digvid,China ousts two defense ministers as Xi seeks loyalty,"After months of intense speculation and official reticence, China has finally confirmed its two former defense ministers who vanished from public view last year had been under investigation for corruption. CNN’s Will Ripley reports.","Jul 6, 2024",2024-10-15,China News,-,China,-
CNN,https://www.cnn.com/2024/07/05/business/tesla-enters-chinese-government-purchase-list-for-first-time-intl-hnk/index.html,Tesla is now an official Chinese government car,"For the first time ever, Tesla cars have been placed on a Chinese government’s purchase list, according to state-owned media outlet Paper.cn.","Jul 5, 2024",2024-10-15,China News,-,China,-
CNN,https://www.cnn.com/2024/07/04/business/germany-blocks-vw-subsidiary-china/index.html,Germany blocks another big business deal with China,"Germany has blocked the sale of a Volkswagen subsidiary to a Chinese state-owned company on national security grounds, delivering a fresh blow to the already tense relationship with its biggest trading partner.","Jul 4, 2024",2024-10-15,China News,-,China,-
CNN,https://www.cnn.com/2024/07/04/asia/putin-xi-russia-china-alignment-sco-astana-intl-hnk/index.html,China’s Xi urges regional leaders to resist ‘external interference’ as security bloc grows to counter US,Chinese leader Xi Jinping on Thursday urged regional leaders to resist “external interference” at a gathering of a Eurasian security bloc touted by Beijing and Moscow as a counterbalance to Western power.,"Jul 4, 2024",2024-10-15,China News,-,China,-
CNN,https://www.cnn.com/2024/07/03/business/china-bond-market-bank-crisis-svb-intl-hnk/index.html,Chinese government bonds are on fire. That’s ringing alarm bells in Beijing,"Money is rushing into Chinese government bonds, sending their prices soaring as investors hunt for a safer alternative to real estate and stocks. Beijing is worried about a bust that could bring down some banks.","Jul 3, 2024",2024-10-15,China News,-,China,-
CNN,https://www.cnn.com/2024/07/02/china/china-russia-belarus-full-member-sco-summit-intl-hnk/index.html,A growing club led by Xi and Putin to counter the US is adding a staunchly pro-Russia member,A club of Eurasian countries spearheaded by China and Russia to advance their leaders’ vision of an alternative world order is set to expand again this week – this time adding a staunch Russian ally that has openly supported Moscow’s war on ...,"Jul 3, 2024",2024-10-15,China News,-,China,-
CNN,https://www.cnn.com/2024/07/01/science/nasa-bill-nelson-china-change-6-samples-scn/index.html,NASA administrator weighs in on China’s historic lunar far side samples — and potential US access,China now has the first samples ever collected from the far side of the moon and says it will share them with scientists around the world. But a 2011 law complicates access for the US.,"Jul 2, 2024",2024-10-15,China News,-,China,-
CNN,https://www.cnn.com/2024/07/01/world/video/chinese-rocket-crash-accidental-launch-ldn-digvid,See Chinese rocket crash after accidentally launching,"On June 30, a Chinese rocket crashed into the hills of Gongyi in central China after being accidentally launched during a ground test, according to a statement from the company, Space Pioneer. No injuries have been reported.","Jul 1, 2024",2024-10-15,China News,-,China,-
CNN,https://www.cnn.com/2024/07/01/business/china-economy-uneven-recovery-intl-hnk/index.html,There is no end in sight for China’s uneven economic recovery,"Factory activity among China’s private firms expanded at the fastest pace in three years, a private gauge showed Monday. But an official survey of bigger business showed activity shrinking.","Jul 1, 2024",2024-10-15,China News,-,China,-
CNN,https://www.cnn.com/2024/07/01/china/china-defense-ministers-downfall-analysis-intl-hnk/index.html,How ready is China’s military? Dramatic downfall of two defense ministers raises questions,The downfall of two defense ministers over corruption allegations raises tough questions about the country’s combat readiness at a time of heightened tensions.,"Jul 1, 2024",2024-10-15,China News,-,China,-
CNN,https://www.cnn.com/2024/06/27/china/china-expels-former-defense-ministers-party-intl-hnk/index.html,China expels two former defense ministers from Communist Party as military purge deepens,"China on Thursday expelled its former Defense Minister Li Shangfu from the ruling Communist Party over corruption allegations, state broadcaster CCTV reported, eight months after he was dramatically removed from the post.","Jun 28, 2024",2024-10-15,China News,-,China,-
CNN,https://www.cnn.com/2024/06/26/business/china-adidas-employees-out-corruption-probe-hnk-intl/index.html,Two Adidas employees out in China corruption probe,Two employees have left Adidas as a result of an ongoing investigation launched by the German sportswear brand into allegations of corruption in China.,"Jun 26, 2024",2024-10-15,China News,-,China,-
CNN,https://www.cnn.com/2024/06/21/china/china-death-penalty-diehard-taiwan-separatists-intl-hnk/index.html,China threatens death penalty for ‘diehard’ Taiwan separatists,"China on Friday threatened to impose the death penalty in extreme cases for “diehard” Taiwan independence separatists, a ratcheting up of pressure even though Chinese courts have no jurisdiction on the democratically governed island.","Jun 26, 2024",2024-10-15,China News,-,China,-
CNN,https://www.cnn.com/2024/06/25/sport/zhang-ziyu-basketball-star-china-spt-intl/index.html,China’s 7-foot-3 teenage basketball star Zhang Ziyu shows promise at youth tournament,"At 7-foot-3, China’s teenage basketball star Zhang Ziyu looks to have an exciting career ahead of her, dominating so far at the FIBA Under-18 Women’s Asia Cup.","Jun 25, 2024",2024-10-15,China News,-,China,-
CNN,https://www.cnn.com/2024/06/25/economy/china-li-qiang-economic-decoupling-warning-intl-hnk/index.html,China warns against ‘vicious cycle’ of decoupling from the West,"Chinese Premier Li Qiang has warned against a “vicious cycle” of economic decoupling from the West, as Beijing struggles to contain rising global pushback over soaring electric vehicle (EV) exports.","Jun 25, 2024",2024-10-15,China News,-,China,-
CNN,https://www.cnn.com/2024/06/25/china/china-change-6-moon-mission-return-scn-intl-hnk/index.html,China’s Chang’e-6 moon mission returns to Earth with historic far side samples,"China’s Chang’e-6 lunar module returned to Earth Tuesday, completing its historic mission to collect the first ever samples from the far side of the moon in a major step forward for the country’s ambitious space program.","Jun 25, 2024",2024-10-15,China News,-,China,-
CNN,https://www.cnn.com/2024/06/24/world/video/china-space-debris-jiang-062411aseg2-cnni-world-fast,Video shows object falling toward Chinese village,CNN’s Steven Jiang reports on videos that show objects falling toward Chinese village after rocket launch. ,"Jun 24, 2024",2024-10-15,China News,-,China,-
CNN,https://www.cnn.com/2024/06/24/world/video/china-rocket-debris-ldn-digvid,Video shows suspected Chinese rocket debris falling over village,"On June 22, people witnessed suspected rocket debris plummeting to the ground over a village in China. This came shortly after a Long March 2C rocket was launched from the Xichang Satellite Launch Centre in the province of Sichuan.","Jun 24, 2024",2024-10-15,China News,-,China,-
CNN,https://www.cnn.com/2024/06/24/china/china-rocket-debris-falls-over-village-intl-hnk/index.html,"Suspected Chinese rocket debris seen falling over village after launch, video shows","Suspected debris from a Chinese rocket was seen plummeting to the ground over a village in southwest China on Saturday, leaving a trail of bright yellow smoke and sending villagers running, according to videos on Chinese social media and sent ...","Jun 25, 2024",2024-10-15,China News,-,China,-
CNN,https://www.cnn.com/2024/06/24/tech/china-huawei-harmony-os-growth-intl-hnk/index.html,Huawei isn’t just back from the dead. It’s a force to be reckoned with,Huawei is in the midst of one of the most stunning comebacks in the history of the tech industry.,"Jun 24, 2024",2024-10-15,China News,-,China,-
CNN,https://www.cnn.com/2024/06/23/china/china-wary-putin-kim-new-alliance-intl-hnk/index.html,China is watching warily as Putin and Kim forge new ‘alliance’,"As Russian President Vladimir Putin glided through the crowd-lined streets of Pyongyang atop a luxury Mercedes-Benz alongside his North Korean host Kim Jong Un this week, the two autocrats’ most important partner was watching ...","Jun 24, 2024",2024-10-15,China News,-,China,-
CNN,https://www.cnn.com/2024/06/23/world/video/space-062312a-seg2-cnni-world-fast,A French-Chinese satellite launch and a setback for Starliner,"A French-Chinese satellite is launched into space and NASA postpones Starliner’s return, again.","Jun 23, 2024",2024-10-15,China News,-,China,-
CNN,https://www.cnn.com/2024/06/21/china/southern-china-flooding-deaths-intl-hnk/index.html,Relentless deadly rains lash southern China as flooding threatens millions,"Tens of thousands of people across southern China have been evacuated, with many more potentially at risk, as deadly torrential rains continue to lash the region, causing flash flooding and mudslides.","Jun 23, 2024",2024-10-15,China News,-,China,-
CNN,https://www.cnn.com/2024/06/21/china/china-taiwan-quarantine-intl-hnk-ml/index.html,How China could take Taiwan without even needing to invade,"China’s military could isolate Taiwan, cripple its economy, and make the democratic island succumb to the will of Beijing’s ruling Communist Party without ever firing a shot, a prominent think tank warns in a new report.","Jun 22, 2024",2024-10-15,China News,-,China,-
CNN,https://www.cnn.com/2024/06/21/tech/apple-ai-chatgpt-ban-china/index.html,Apple’s new China problem: ChatGPT is banned there,"Apple is banking on its upcoming AI features to boost iPhone sales especially in China, where demand has been lagging. But there’s a problem: ChatGPT — soon to be integrated into Siri — is banned in China.","Jun 21, 2024",2024-10-15,China News,-,China,-
CNN,https://www.cnn.com/2024/06/21/business/china-local-government-tax-crackdown-intl-hnk/index.html,Chinese cities desperate for cash are chasing companies for taxes — some from the 1990s,"Authorities in cash-strapped Chinese cities are chasing companies for taxes dating back years, and in some cases decades, as they try to plug a hole blown in their finances by the real estate crisis.","Jun 21, 2024",2024-10-15,China News,-,China,-
CNN,https://www.cnn.com/2024/06/21/world/video/china-rain-flood-deaths-jiang-lklv-062101aseg2-cnni-world-fast,"Eighteen killed, at least six missing following heavy rain in southern China",Over sixty thousand people have been evacuated as the Chinese city of Guilin experiences its worst flooding in over three decades. CNN’s Steven Jiang has the latest.,"Jun 21, 2024",2024-10-15,China News,-,China,-
CNN,https://www.cnn.com/2024/06/20/world/video/putin-vietnam-asia-jiang-live-042003aseg1-cnni-world-fast,Vladimir Putin in Vietnam after landmark visit to North Korea,CNN’s Steven Jiang reports on the Russian president’s trip to Asia and how China is reacting to the visit. ,"Jun 20, 2024",2024-10-15,China News,-,China,-
CNN,https://www.cnn.com/2024/06/20/asia/philippines-footage-south-china-sea-clash-china-intl-hnk/index.html,‘Only pirates do this’: Philippines accuses China of using bladed weapons in major South China Sea escalation,"The Philippines has accused China’s Coast Guard of launching a “brutal assault” with “bladed weapons” during a South China Sea clash earlier this week, a major escalation in a festering dispute that threatens to drag the United States into ...","Jun 20, 2024",2024-10-15,China News,-,China,-
CNN,https://www.cnn.com/2024/06/20/world/video/china-philippines-hostilities-watson-live-062001aseg1-cnni-world-fast,Filipino military personnel ‘fought with bare hands’ following collision with Chinese Coast Guard vessel,Manila has accused China of injuring Filipino personnel and damaging Philippine vessels during a South China Sea collision earlier this week. CNN’s Ivan Watson reports that tensions have been simmering over territorial disputes in the ...,"Jun 20, 2024",2024-10-15,China News,-,China,-
CNN,https://www.cnn.com/2024/06/20/travel/china-chengdu-panda-park-tourists-banned-intl-hnk/index.html,China’s famed panda breeding center bans 12 tourists for life over bad behavior,A dozen tourists have been banned for life from China’s Chengdu Research Base of Giant Panda Breeding for bad behavior like throwing cigarettes and spitting.,"Jun 20, 2024",2024-10-15,China News,-,China,-
CNN,https://www.cnn.com/2024/06/20/business/russia-alfa-bank-china-expansion-intl-hnk/index.html,Alfa Bank: US-sanctioned Russian banking giant expands in China,"Battered by Western sanctions, Russia’s largest privately owned bank is expanding its business in the world’s second-largest economy.","Jun 20, 2024",2024-10-15,China News,-,China,-
CNN,https://www.cnn.com/2024/06/20/world/video/china-philippines-south-china-sea-clash-ldn-digvid,Chinese and Filipino forces clash in tense confrontation in South China Sea,"The Philippines has accused China’s Coast Guard of launching a “brutal assault” with bladed weapons during a clash in the South China Sea earlier this week, a major escalation in a festering dispute that threatens to drag the United States ...","Jun 20, 2024",2024-10-15,China News,-,China,-
CNN,https://www.cnn.com/2024/06/19/world/video/florida-china-property-lawsuit-live-king-061904pseg2-cnni-business-fast,Florida Faces Lawsuit over Restrictions on Chinese Nationals Buying Property,"Echo Meisheng King, the president of the Florida Asian American Justice Alliance, discusses the impacts of the controversial ban.","Jun 20, 2024",2024-10-15,China News,-,China,-
CNN,https://www.cnn.com/2024/06/19/asia/south-china-sea-philippines-injury-intl-hnk/index.html,Philippines blames China for ‘personnel injury and vessel damage’ in South China Sea collision,"Manila has accused China of injuring Filipino personnel and damaging Philippine vessels during a South China Sea collision earlier this week, as tensions simmer over territorial disputes in the resource-rich and strategically important waterway.","Jun 19, 2024",2024-10-15,China News,-,China,-
CNN,https://www.cnn.com/2024/06/18/asia/us-condemns-china-scs-collision-philippines-intl-hnk/index.html,US blasts ‘aggressive’ China over South China Sea collision with Philippine ship,"The United States on Monday condemned China over a collision with the Philippines in the disputed South China Sea, the latest in a series of increasingly fraught confrontations that have raised the potential of a flashpoint for global ...","Jun 19, 2024",2024-10-15,China News,-,China,-
CNN,https://www.cnn.com/2024/06/18/cars/berkshire-hathaway-byd-china-ev-tensions-intl-hnk/index.html,Warren Buffett’s Berkshire Hathaway dumps BYD shares following rise in trade tension over Chinese EVs,"Warren Buffett’s Berkshire Hathaway has further cut its large stake in BYD, which vies with Tesla as the world’s largest electric car (EV) maker, as global trade tensions escalate over Chinese EVs.","Jun 18, 2024",2024-10-15,China News,-,China,-
CNN,https://www.cnn.com/2024/06/17/politics/us-alarm-china-north-korea-russia/index.html,US sounds alarm over Chinese and North Korean support for Russia’s war in Ukraine,"The question wasn’t even directed toward President Joe Biden, but his determination to get in an answer created a revealing moment about the war in Ukraine, Russian President Vladimir Putin’s war machine and deepening US ...","Jun 18, 2024",2024-10-15,China News,-,China,-
CNN,https://www.cnn.com/2024/06/17/business/china-adidas-embezzlement-investigation-whistleblowers-intl-hnk/index.html,Adidas is investigating allegations of embezzlement and kickbacks in China,"Adidas says it has started an investigation into allegations of “compliance violations” in China, a key market for its sportswear.","Jun 17, 2024",2024-10-15,China News,-,China,-
CNN,https://www.cnn.com/2024/06/17/business/china-europe-pork-imports/index.html,China probes European pork prices after EU hikes tariffs on its electric cars,"Beijing has launched an investigation into prices of pork from the European Union, targeting a major EU food export just days after Brussels hiked tariffs on electric vehicles from China.","Jun 17, 2024",2024-10-15,China News,-,China,-
CNN,https://www.cnn.com/2024/06/14/china/g7-accuses-china-enabling-russia-war-ukraine-intl-hnk/index.html,G7 leaders accuse China of ‘enabling’ Russia war on Ukraine in stark warning,"China’s support for Russia is “enabling” its war in Ukraine, leaders of the world’s most advanced economies warned Friday in a hardening of tone against Beijing, threatening further sanctions against actors that materially support Moscow’s ...","Jun 17, 2024",2024-10-15,China News,-,China,-
CNN,https://www.cnn.com/2024/06/17/business/china-property-price-record-slump-intl-hnk/index.html,China is trying to rescue its property market. Prices are still plunging,"Prices of new homes in China suffered their biggest fall in nearly a decade last month, in a sign that Beijing’s “historic” real estate rescue has not yet revived demand.","Jun 17, 2024",2024-10-15,China News,-,China,-
CNN,https://www.cnn.com/2024/06/17/australia/australia-china-cheng-lei-blocked-intl-hnk/index.html,Chinese officials’ attempt to ‘block’ formerly detained journalist mars Australia goodwill tour,Apparent efforts by Chinese officials to stand in front of Cheng Lei during a news briefing shone a spotlight back on frictions between the countries.,"Jun 18, 2024",2024-10-15,China News,-,China,-
CNN,https://www.cnn.com/2024/06/17/china/china-floods-guangdong-fujian-intl-hnk/index.html,Thousands evacuated as floods and deadly landslides hit southeast China,"Thousands of people have been evacuated in southeast China after heavy rains hammered the region over the weekend, triggering floods and deadly landslides, authorities and state media said Monday.","Jun 17, 2024",2024-10-15,China News,-,China,-
CNN,https://www.cnn.com/2024/06/17/world/video/china-premier-li-australia-visit-lu-stout-live-061702aseg2-cnni-world-fast,Chinese premier welcomed in Australia,"CNN’s Kristie Lu Stout reports on Chinese Premier Li Qiang’s four-day visit to Australia, which is aimed at further warming ties between Beijing and Canberra.","Jun 17, 2024",2024-10-15,China News,-,China,-
CNN,https://www.cnn.com/2024/06/16/style/new-chinese-style-gen-z-intl-hnk/index.html,"The latest fashion trend gripping young Chinese isn’t actually new, but it’s proving lucrative","The trend merges all manner of contemporary design with traditional Chinese aesthetics, applied to everything from clothing to furniture. Here’s why it’s popular.","Jun 17, 2024",2024-10-15,China News,-,China,-
CNN,https://www.cnn.com/2024/06/16/travel/high-speed-sleeper-train-hong-kong-beijing-shanghai-intl-hnk/index.html,New high-speed sleeper train service connects Hong Kong with Beijing and Shanghai,Interested in capping off your trip to Hong Kong with a long weekend in Beijing or Shanghai? A new high-speed sleeper train service cuts the overnight travel time by half.,"Jun 17, 2024",2024-10-15,China News,-,China,-
CNN,https://www.cnn.com/2024/06/16/australia/china-australia-pandas-adelaide-intl-hnk/index.html,China to send a new pair of giant pandas to Australia in sign of warming ties,"China will provide a new pair of giant pandas to Australia’s Adelaide Zoo, Premier Li Qiang said on Sunday.","Jun 16, 2024",2024-10-15,China News,-,China,-
CNN,https://www.cnn.com/2024/06/15/world/video/stout-pkg-061512a-seg2-cnni-world-fast,China faces extreme weather,"Kristie Lu Stout reports that China is facing torrential rain and severe drought, raising concerns about food insecurity.","Jun 15, 2024",2024-10-15,China News,-,China,-
CNN,https://www.cnn.com/2024/06/14/world/video/chinese-consumers-stewart-pkg-fst061406pseg1-cnni-business-fast,"Domestic, Foreign Firms Help Chinese Consumers Make Ends Meet.",Marc Stewart reports how companies are slashing prices in China in a bid to drive up consumer demand.,"Jun 15, 2024",2024-10-15,China News,-,China,-
CNN,https://www.cnn.com/2024/06/14/business/china-record-heat-rain-food-security-intl-hnk/index.html,China’s record heat and heavy rain raise food security concerns,"China is grappling with extreme weather as severe drought and record temperatures scorch the north while heavy rains inundate the south, raising concerns about food security in the world’s second-largest economy.","Jun 14, 2024",2024-10-15,China News,-,China,-
CNN,https://www.cnn.com/2024/06/13/world/video/eu-china-ev-tariffs-jiang-live-061312aseg2-cnni-world-fast,Europe risks trade war with China by hiking tariffs on Chinese electric cars,CNN’s Steven Jiang looks at the implications of the move.,"Jun 13, 2024",2024-10-15,China News,-,China,-
CNN,https://www.cnn.com/2024/06/12/world/video/stewart-eu-china-tariffs-061211aseg2-cnni-world-fast,Europe increases tariffs on Chinese electric vehicles,CNN’s Anna Stewart looks at the new EU tariffs imposed on Chinese electric vehicles.,"Jun 12, 2024",2024-10-15,China News,-,China,-
CNN,https://www.cnn.com/2024/06/10/asia/chinese-military-harass-dutch-warship-intl-hnk-ml/index.html,"Chinese military harassed Dutch warship enforcing UN sanctions on North Korea, Netherlands says","A Dutch warship was harassed by Chinese military aircraft in the East China Sea on Friday, the Netherlands said, becoming the latest country to accuse Beijing’s forces of initiating potentially unsafe encounters in international waters.","Jun 10, 2024",2024-10-15,China News,-,China,-
CNN,https://www.cnn.com/2024/06/10/china/northern-china-heat-wave-intl-hnk/index.html,Northern China braces for record high temperatures in major heat wave,"A major heat wave is forecast to spread across large swathes of northern China this week, bringing record high temperatures to some areas, according to China’s meteorological authorities.","Jun 10, 2024",2024-10-15,China News,-,China,-
