Source,Link,Headline,Description,Date,Timestamp,Topic,Author,Region,Article_Content
BBC,https://www.bbc.com/news/articles/c9qve471ydqo,Two men deny spying for China,Christopher Berry and former parliamentary researcher Christopher Cash appeared at the Old Bailey on Friday.,4 Oct 2024,2024-10-15,China News,-,China,-
BBC,https://www.bbc.com/news/articles/cn8jz39xl19o,China hits back at EU with brandy tax,The tax on brandy imports is being seen by critics as a retaliatory move for recent EU tariffs on Chinese-made electric cars.,7 days ago,2024-10-15,China News,-,China,-
BBC,https://www.bbc.com/news/articles/cqjrplrvpvpo,China detains iPhone maker workers in 'strange' case,"The Taiwanese government suggested the detentions may be a case of ""abuse of power"" by Chinese police.",4 days ago,2024-10-15,China News,-,China,-
BBC,https://www.bbc.com/news/articles/cvgd4yn45qlo,China 'punishes' Taiwan president remarks with new drills,Beijing says the exercise involved all parts of the military and simulates a full-scale attack on its neighbour.,19 hrs ago,2024-10-15,China News,-,China,-
BBC,https://www.bbc.com/news/articles/c8elgd52x4wo,China stock rally fizzles as stimulus news disappoints,Shares fell back after a news conference by economic planners gave little in the way of details.,7 days ago,2024-10-15,China News,-,China,-
BBC,https://www.bbc.com/sport/tennis/articles/c1jd97g25z8o,Gauff fights back to reach China Open final,Fourth seed Coco Gauff comes from a set and a break down to beat Paula Badosa and reach her first China Open final.,5 Oct 2024,2024-10-15,China News,-,China,-
BBC,https://www.bbc.com/sport/tennis/articles/c8ely9n1e61o,Gauff overcomes setback to reach China Open semis,Coco Gauff fought back from a set down to beat Yuliia Starodubtseva.,3 Oct 2024,2024-10-15,China News,-,China,-
BBC,https://www.bbc.com/sport/tennis/articles/ce8v6560lnro,Alcaraz beats Sinner in dramatic China Open final,Carlos Alcaraz comes from a set down to edge out world number one Jannik Sinner in a dramatic China Open final.,2 Oct 2024,2024-10-15,China News,-,China,-
BBC,https://www.bbc.com/sport/tennis/articles/c2kdnvnz0qpo,Gauff through after Osaka withdraws at China Open,Fourth seed Coco Gauff is through to the quarter-finals of the China Open after Japan's Naomi Osaka is forced to retire injured in their last-16 match.,1 Oct 2024,2024-10-15,China News,-,China,-
BBC,https://www.bbc.com/sport/tennis/articles/c2lngkzl8yyo,Gauff beats Muchova in China for eighth WTA title,American fourth seed Coco Gauff beats Karolina Muchova 6-1 6-3 in the China Open final to claim her eighth WTA title.,6 Oct 2024,2024-10-15,China News,-,China,-
BBC,https://www.bbc.com/sport/tennis/articles/cqlvkvy6qxgo,Muchova ends Sabalenka streak to reach China Open semis,Karolina Muchova resists a fightback from number one seed Aryna Sabalenka to reach the semi-finals of the China Open.,4 Oct 2024,2024-10-15,China News,-,China,-
BBC,https://www.bbc.com/news/articles/cwyvng0jw78o,"CIA seeks informants in North Korea, Iran and China","The US spy agency posted callouts on YouTube, Instagram, LinkedIn and the dark web.",3 Oct 2024,2024-10-15,China News,-,China,-
BBC,https://www.bbc.com/news/articles/c20pxwwqqzwo,China probes Calvin Klein over Xinjiang cotton,Beijing says it suspects US brands are discriminating against Chinese cotton after allegations of forced labour.,25 Sep 2024,2024-10-15,China News,-,China,-
BBC,https://www.bbc.com/news/articles/cx2k42n54kvo,Does China now have a permanent military base in Cambodia?,Satellite images show the steady expansion of naval facilities that have international onlookers worried.,7 days ago,2024-10-15,China News,-,China,-
BBC,https://www.bbc.com/sport/tennis/articles/c70wxeyjw4go,Boulter loses to Gauff in China Open third round,Katie Boulter is out of the China Open after suffering a straight-set defeat by Coco Gauff on Sunday.,29 Sep 2024,2024-10-15,China News,-,China,-
BBC,https://www.bbc.com/news/articles/c3dvrxg8mllo,"As communist China turns 75, can Xi fix its economy?",Plans announced by officials sparked a stock market rally but economists are unsure it is enough.,4 Oct 2024,2024-10-15,China News,-,China,-
BBC,https://www.bbc.com/news/articles/cjd5xlv03jxo,China unveils raft of measures to boost economy,It comes just days after the US central bank cut interest rates for the first time in over four years.,24 Sep 2024,2024-10-15,China News,-,China,-
BBC,https://www.bbc.com/news/articles/cly20n4d0g9o,EU hits China with big taxes in electric car sales battle,The vote risks sparking a trade war as the EU looks to protect its own car makers.,4 Oct 2024,2024-10-15,China News,-,China,-
BBC,https://www.bbc.com/news/articles/ckg9nwxy388o,Schoolboy's killing in China sparks Japanese fears,Stabbing of 10-year-old schoolboy in Shenzhen is the second attack on Japanese nationals this year.,20 Sep 2024,2024-10-15,China News,-,China,-
BBC,https://www.bbc.com/news/articles/cqjrq0ewj77o,"China nuclear sub sank in its dock, US officials say","The submarine sank earlier this year, in a major setback for the Chinese military, say US defence officials.",27 Sep 2024,2024-10-15,China News,-,China,-
BBC,https://www.bbc.com/reel/video/p0jsjzb6/china-expert-says-stimulus-package-is-only-the-beginning,China expert says stimulus package is only the beginning,Janet Mui of RBC Brewin Dolphin says the Chinese measures should defend the countries 5% growth target.,24 Sep 2024,2024-10-15,China News,-,China,-
BBC,https://www.bbc.com/sport/tennis/articles/c5y0k1dlj62o,From winless in 603 days to making history in China,"After ending the longest losing streak for 52 years, China's Zhang Shuai makes history at the China Open by stunning US Open semi-finalist Emma Navarro.",27 Sep 2024,2024-10-15,China News,-,China,-
BBC,https://www.bbc.com/news/articles/cly6xpz9p1no,A Japanese boy was killed in China. Was cyber-nationalism to blame?,The Chinese government has been accused of using online nationalism as a useful safety valve.,1 day ago,2024-10-15,China News,-,China,-
BBC,https://www.bbc.com/news/articles/cd0z289ervmo,Finland to return pandas to China early due to cost,Inflation and debt are among the reasons Lumi and Pyry are being sent home eight years early.,25 Sep 2024,2024-10-15,China News,-,China,-
BBC,https://www.bbc.com/sport/triathlon/videos/c98yw46ywd6o,'Race to be proud of' - Yee on tough win in China,"Great Britain's Olympic champion Alex Yee says he is ""proud"" of his World Triathlon Championship Series win in Weihai, China.",27 Sep 2024,2024-10-15,China News,-,China,-
BBC,https://www.bbc.com/news/articles/ckgvr9kgkqyo,China is part of the US election - but only from one candidate,There is a stark difference in how - and how often - each candidate addresses the US-China relationship.,27 Sep 2024,2024-10-15,China News,-,China,-
BBC,https://www.bbc.com/news/articles/cy94qq01qweo,Ten-year-old Japanese boy dies after stabbing in China,Authorities say the boy was attacked outside Shenzhen Japanese School in southern China.,19 Sep 2024,2024-10-15,China News,-,China,-
BBC,https://www.bbc.com/news/articles/cje2ejnwwx9o,UK accounting giant PwC faces six-month China ban,The firm is being penalised for its role in the failure of property giant Evergrande.,13 Sep 2024,2024-10-15,China News,-,China,-
BBC,https://www.bbc.com/news/articles/c62421le4j6o,China raises retirement age for first time since 1950s,"The plan, which will set in from January, has been on the cards for a few years as China's population ages.",13 Sep 2024,2024-10-15,China News,-,China,-
BBC,https://www.bbc.com/news/articles/czjyj2rd1zpo,China spent millions on this new trade route - then a war got in the way,"The BBC visits the border with Myanmar, where a war is raging on China’s doorstep.",20 Sep 2024,2024-10-15,China News,-,China,-
BBC,https://www.bbc.com/news/articles/ce9zlkz0ypyo,Row over aircons in classrooms as China swelters,Parents' calls to install air conditioners in classrooms spark a debate online.,10 Sep 2024,2024-10-15,China News,-,China,-
BBC,https://www.bbc.com/news/articles/cevjrvkm28go,Ex-CIA officer jailed for 10 years as spy for China,"Alexander Yuk Ching Ma, 71, admitted selling secrets to China while working for the CIA and FBI.",12 Sep 2024,2024-10-15,China News,-,China,-
BBC,https://www.bbc.com/news/articles/cp95mdjk95ko,Taiwan's president vows to resist 'annexation',William Lai made the comments on the self-governing island's national day address amid tensions with China.,5 days ago,2024-10-15,China News,-,China,-
BBC,https://www.bbc.com/news/articles/cn4zpy3zj7ro,Harris or Trump? What Chinese people want from US election,People in Beijing tell the BBC's Laura Bicker their hopes and fears about who will win the White House race.,1 day ago,2024-10-15,China News,-,China,-
BBC,https://www.bbc.com/news/articles/cly39yvde0go,Disabled orphans bear brunt of China's overseas adoption ban,"These kids, who make up the vast majority of those put up for adoption, face a painful wait for families.",5 days ago,2024-10-15,China News,-,China,-
BBC,https://www.bbc.com/news/articles/crl8xee75wgo,How China’s crackdown turned finance high-flyers into ‘rats’,Chinese authorities have been cracking down on businesses from real estate to technology to finance.,4 days ago,2024-10-15,China News,-,China,-
BBC,https://www.bbc.com/news/articles/crmwrpe3m3do,Uncertainty for families as China ends foreign adoptions,"Beijing has given little reason for the change, only saying it was line with international agreements.",6 Sep 2024,2024-10-15,China News,-,China,-
BBC,https://www.bbc.com/reel/video/p0jwn812/renewable-energy-is-growing-due-to-low-prices-9-oct-2024,Renewable energy is growing due to low prices - 9 Oct 2024,"IEA head says world is adding as much renewable energy by 2030 as current capacity of China, India, EU and US.",6 days ago,2024-10-15,China News,-,China,-
BBC,https://www.bbc.com/news/articles/c3e95lny0x9o,Xi Jinping is worried about the economy - what do Chinese people think?,Two new pieces of research offer a rare glimpse into how Chinese people feel about their future.,1 Oct 2024,2024-10-15,China News,-,China,-
BBC,https://www.bbc.com/news/articles/cj9jgmexmx4o,BBC boss warns of Russian and Chinese propaganda,"The UK is losing out because of cuts to the World Service, the BBC's director general warns.",13 hrs ago,2024-10-15,China News,-,China,-
BBC,https://www.bbc.com/news/articles/c0e1zjqdlp2o,Screams and chaos: Eyewitnesses describe Shanghai mall stabbings,This incident is the latest in a spate of knife attacks to hit China this year.,2 Oct 2024,2024-10-15,China News,-,China,-
BBC,https://www.bbc.com/news/articles/c9dyxpe2dy1o,Three dead and 15 hurt in Shanghai Walmart stabbing,"Police arrested a 37-year-old man at the scene, and said further investigations were continuing.",1 Oct 2024,2024-10-15,China News,-,China,-
BBC,https://www.bbc.com/sport/tennis/articles/cd98yw9g08eo,Sabalenka beats Keys to reach Beijing quarters,Aryna Sabalenka extends winning streak to 15 matches to reach the China Open quarter-finals with a straight-set victory against Madison Keys.,2 Oct 2024,2024-10-15,China News,-,China,-
BBC,https://www.bbc.com/news/articles/cdxl8j8lyjzo,Fury as Filipino officials pose with 'China spy mayor',Disgraced ex-mayor Alice Guo flashes a wide smile and the peace sign in photos with her escorts.,6 Sep 2024,2024-10-15,China News,-,China,-
BBC,https://www.bbc.com/news/articles/c9qvy913012o,Aston Martin shares shaken after profit warning,"The company, famed for its links to James Bond, has been hit by falling sales in China.",30 Sep 2024,2024-10-15,China News,-,China,-
BBC,https://www.bbc.com/news/articles/ce8vz8j60kno,Maldives president visits India amid trouble in tourist paradise,President Muizzu is visiting India at a time when his country is staring at an economic crisis.,6 Oct 2024,2024-10-15,China News,-,China,-
BBC,https://www.bbc.com/news/articles/c2ek1x3p7rjo,Maldives president in Delhi to seek aid and reboot ties,Mohamed Muizzu is expected to seek a bailout worth hundreds of millions of dollars during his India visit.,6 Oct 2024,2024-10-15,China News,-,China,-
BBC,https://www.bbc.com/news/articles/cm248g49nveo,Walz says he 'misspoke' in personal story about Tiananmen Square,"""I’m a knucklehead at times,"" the Democratic running mate says, conceding he was in the US when Chinese forces crushed protests.",2 Oct 2024,2024-10-15,China News,-,China,-
BBC,https://www.bbc.com/news/articles/cm28yd04xxno,Japan sails warship in Taiwan Strait for first time,There has been a rise in patrols by the US and its allies who do not accept China's claims over the strait.,26 Sep 2024,2024-10-15,China News,-,China,-
BBC,https://www.bbc.com/news/articles/cly4eq78k5qo,Indian financial aid opens 'new chapter' with Maldives,The deal comes as the Maldives president visits Delhi after relations nosedived in recent months.,8 days ago,2024-10-15,China News,-,China,-
BBC,https://www.bbc.com/sport/tennis/articles/c9wk7j7q0wro,Swiatek splits with coach Wiktorowski,"Iga Swiatek, the world number one, announces split with coach Tomasz Wiktorowski.",4 Oct 2024,2024-10-15,China News,-,China,-
BBC,https://www.bbc.com/news/articles/cn8jpgqpeejo,Warning of rise in creepy crawlies found lurking inside parcels,"Three venomous scorpions have been found in parcels in the UK in the last month, expert Chris Newman says.",3 days ago,2024-10-15,China News,-,China,-
BBC,https://www.bbc.com/sport/tennis/articles/cgmgnl0yv9vo,"Djokovic, Sinner and Alcaraz win Shanghai openers",Novak Djokovic wins on ATP Tour return to join Jannik Sinner and Carlos Alcaraz in the third round of the Shanghai Masters.,5 Oct 2024,2024-10-15,China News,-,China,-
BBC,https://www.bbc.com/news/articles/c4gl843l90zo,China's long-range missile test sparks concerns,"Beijing said the test was ""routine"" but other countries in the region expressed strong concerns.",25 Sep 2024,2024-10-15,China News,-,China,-
BBC,https://www.bbc.com/sport/tennis/articles/c148g1ze63do,Draper out of Shanghai Masters with injury,Britain's Jack Draper withdraws from this week's Shanghai Masters after injuring himself at the Japan Open.,30 Sep 2024,2024-10-15,China News,-,China,-
BBC,https://www.bbc.com/news/articles/cr5482yygp4o,Hong Kong jails two journalists for sedition,Editors at a now-defunct news site published articles about the city's national security crackdown.,26 Sep 2024,2024-10-15,China News,-,China,-
BBC,https://www.bbc.com/news/videos/crejxl4zv33o,Rare brightening comet seen passing Earth from Hawaii,"Scientists estimate the last time Comet Tsuchinshan-ATLAS visited our solar system was 80,000 years ago.",4 Oct 2024,2024-10-15,China News,-,China,-
BBC,https://www.bbc.com/sport/snooker/articles/cgk7pdndg8no,Si compiles 147 maximum as he sweeps past Trump,Si Jiahui compiles the first 147 maximum break of his career as he beats world number one Judd Trump 6-2 in the semi-finals of the Wuhan Open.,4 days ago,2024-10-15,China News,-,China,-
BBC,https://www.bbc.com/news/articles/cx250ygn9ddo,Oil price rise comes at a critical point,Any extended rise raises the possibility of higher petrol prices and gas and electricity bills.,3 Oct 2024,2024-10-15,China News,-,China,-
BBC,https://www.bbc.com/news/articles/cz048934ygro,Chinese woman held in Germany for spying on arms firm,A Chinese woman has been arrested on suspicion of passing on information about Leipzig/Halle airport.,1 Oct 2024,2024-10-15,China News,-,China,-
BBC,https://www.bbc.com/sport/tennis/articles/cwyl20y3ge7o,Gauff hits 21 double faults as Sabalenka reaches final,Aryna Sabalenka recovers from a set down against Coco Gauff to reach the final of the Wuhan Open.,3 days ago,2024-10-15,China News,-,China,-
BBC,https://www.bbc.com/sport/tennis/articles/cg78e7lmkpjo,Erika Andreeva beats sister Mirra in first meeting,Erika Andreeva defeats higher-ranked younger sister Mirra in the first professional meeting between the two siblings to reach the last 16 at the Wuhan Open.,6 days ago,2024-10-15,China News,-,China,-
BBC,https://www.bbc.com/sport/tennis/articles/c0r8x4yjegjo,Raducanu out of Ningbo Open after foot injury,Emma Raducanu withdraws from Ningbo Open after sustaining a foot injury in September.,4 days ago,2024-10-15,China News,-,China,-
BBC,https://www.bbc.com/news/articles/cwyl0ydpjgzo,The shopping centre helping students feel at home,Leeds' Merrion Centre is promoting itself on Chinese social media to its growing East Asian clientele.,27 Sep 2024,2024-10-15,China News,-,China,-
BBC,https://www.bbc.com/news/articles/c62ggdp7yxeo,Why global gaming hit's boss has a Brummie accent,The Chinese game sold more than 4.5 million copies within 24 hours.,3 days ago,2024-10-15,China News,-,China,-
BBC,https://www.bbc.com/sport/triathlon/articles/c4gde1j18pyo,GB's Yee claims victory in Weihai as Potter second,"Great Britain's Olympic champion Alex Yee wins the penultimate race of the World Triathlon Championship Series, as Beth Potter finishes second in the women's race in Weihai, China.",27 Sep 2024,2024-10-15,China News,-,China,-
BBC,https://www.bbc.com/news/articles/ce81g9593dro,US debt would increase under Harris and soar under Trump - study,"Both candidates would add trillions to the national debt if their proposals were enacted, according to a new analysis.",8 days ago,2024-10-15,China News,-,China,-
BBC,https://www.bbc.com/news/articles/c4g42953qm0o,Canadian alleges 'psychological torture' in Chinese jail,"Michael Kovrig, whose arrest kicked off a diplomatic spat, says he was held in solitary confinement for months.",24 Sep 2024,2024-10-15,China News,-,China,-
BBC,https://www.bbc.com/news/articles/cj04955442ro,Myanmar rebels reject embattled junta's peace offer,The offer comes after battlefield losses and defections in the three-year-long civil war.,27 Sep 2024,2024-10-15,China News,-,China,-
BBC,https://www.bbc.com/news/articles/cj9je2wnveko,Does Chinese investment benefit or damage Ireland?,"Ireland is home to 40 Chinese firms, which some critics say harms the country's reputation.",30 Sep 2024,2024-10-15,China News,-,China,-
BBC,https://www.bbc.com/news/articles/cx254ygw9plo,From shop assistant to ceramic designer,Esme Talbot left her Mothercare job to start a craft firm that has won a major contract with Next.,4 days ago,2024-10-15,China News,-,China,-
BBC,https://www.bbc.com/sport/tennis/articles/cx2k1zxjw2go,Djokovic overcomes 'issues' to set up Sinner final,Novak Djokovic will face Jannik Sinner in the Shanghai Masters final on Sunday as he bids for a 100th ATP title.,3 days ago,2024-10-15,China News,-,China,-
BBC,https://www.bbc.com/sport/tennis/articles/c30l67l0jd4o,Alcaraz sees off Medvedev to set up Sinner final,Carlos Alcaraz will play Jannik Sinner in the China Open final after cruising past Daniil Medvedev in straight sets.,1 Oct 2024,2024-10-15,China News,-,China,-
BBC,https://www.bbc.com/news/articles/cwyegl8q80do,US to ban Chinese tech in cars,"Officials say they are worried the technology could allow enemies to ""remotely manipulate cars"".",23 Sep 2024,2024-10-15,China News,-,China,-
BBC,https://www.bbc.com/sport/tennis/articles/cx2k1zxjw2go,Djokovic overcomes 'issues' to set up Sinner final,Novak Djokovic will face Jannik Sinner in the Shanghai Masters final on Sunday as he bids for a 100th ATP title.,3 days ago,2024-10-15,China News,-,China,-
BBC,https://www.bbc.com/news/articles/cvgl05rp8r1o,The 91-year-old African president who keeps defying death rumours,"Cameroon's Paul Biya, 91, has not been seen for about a month, sending the rumour mill into overdrive.",5 days ago,2024-10-15,China News,-,China,-
BBC,https://www.bbc.com/news/articles/cwyegl8q80do,US to ban Chinese tech in cars,"Officials say they are worried the technology could allow enemies to ""remotely manipulate cars"".",23 Sep 2024,2024-10-15,China News,-,China,-
BBC,https://www.bbc.com/sport/snooker/articles/c4gr71zrymvo,Xiao wins Wuhan Open to end 17-year title wait,China's Xiao Guodong beats compatriot Si Jiahui 10-7 in the Wuhan Open final to claim his maiden ranking title in 17 years as a professional.,3 days ago,2024-10-15,China News,-,China,-
BBC,https://www.bbc.com/news/articles/c9qv5q1pz03o,Cameroon insists president is well despite month's absence,"Paul Biya, 91, has not been seen in public for weeks, stoking speculation about his health.",6 days ago,2024-10-15,China News,-,China,-
BBC,https://www.bbc.com/news/articles/czd1g149r3eo,"Mud, fire and sun : Photos of the week",A selection of striking news photographs taken around the world this week.,8 days ago,2024-10-15,China News,-,China,-
BBC,https://www.bbc.com/sport/tennis/articles/cvgxvqp88pjo,Fearnley set for top 100 after fourth title of 2024,Jacob Fearnley is set to break into the top 100 of the men's singles world rankings after winning his fourth Challenger title of 2024.,29 Sep 2024,2024-10-15,China News,-,China,-
BBC,https://www.bbc.com/news/articles/cwye2gljdewo,Cameroon bans reports on President Biya’s health,"Rumours about the leader's death, which have been denied by officials, have been swirling all week.",4 days ago,2024-10-15,China News,-,China,-
BBC,https://www.bbc.com/news/articles/cp8mvmmpmvro,Australia's lithium mining boom hit by sagging prices,"Some producers have halted operations, while others are increasing production, hopeful of an upturn.",26 Sep 2024,2024-10-15,China News,-,China,-
BBC,https://www.bbc.com/sport/tennis/articles/cly739dnpy0o,Alcaraz and Sinner survive tough tests in Shanghai,Carlos Alcaraz and Jannik Sinner come through tough tests at the Shanghai Masters to reach the last 16.,6 Oct 2024,2024-10-15,China News,-,China,-
BBC,https://www.bbc.com/news/articles/cdrj231e5k2o,"Fashion, floods and the Northern Lights: Photos of the week",A selection of striking news photographs taken around the world this week.,3 days ago,2024-10-15,China News,-,China,-
BBC,https://www.bbc.com/news/articles/cpqz2y9jd1ro,Modi meets top US tech leaders amid semiconductor push,The Indian prime minister met CEOs of top tech firms in New York a day after attending the Quad summit.,23 Sep 2024,2024-10-15,China News,-,China,-
BBC,https://www.bbc.com/news/articles/c3rdy132q3lo,Thieves snatched his phone in London - it was in China a month later,Akara tells the BBC about the journey his phone took after it was snatched from his hands by thieves.,7 Sep 2024,2024-10-15,China News,-,China,-
BBC,https://www.bbc.com/news/articles/cgry10924jqo,How worried should I be about rising oil prices?,"As the conflict across the Middle East widens, rising oil prices are being closely watched.",4 Oct 2024,2024-10-15,China News,-,China,-
BBC,https://www.bbc.com/news/articles/cm29j4kx4vmo,"Wait a few more minutes for an electric Uber, says boss",The platform wants customers to go 'green' as it tries to boost the take-up of electric cars.,7 days ago,2024-10-15,China News,-,China,-
BBC,https://www.bbc.com/news/articles/c78lk3gxk8mo,School bus ploughs into crowd in China killing 11,"State media reports the driver is in custody, and police are investigating the cause of the incident.",3 Sep 2024,2024-10-15,China News,-,China,-
BBC,https://www.bbc.com/sport/triathlon/articles/c0kj8vpzgj4o,Watch Potter and Yee in World Triathlon Championship Series,"Beth Potter and Alex Yee lead the British contingent for the World Triathlon Championship Series event in Weihai, and you can watch it live on the BBC.",23 Sep 2024,2024-10-15,China News,-,China,-
BBC,https://www.bbc.com/news/articles/cp8e5624x97o,Solar supplier switched over 'ethical concerns',South Kesteven District Council announced a change of supplier for its leisure centre improvements.,27 Sep 2024,2024-10-15,China News,-,China,-
BBC,https://www.bbc.com/news/articles/cgry10924jqo,How worried should I be about rising oil prices?,"As the conflict across the Middle East widens, rising oil prices are being closely watched.",4 Oct 2024,2024-10-15,China News,-,China,-
BBC,https://www.bbc.com/news/articles/cm29j4kx4vmo,"Wait a few more minutes for an electric Uber, says boss",The platform wants customers to go 'green' as it tries to boost the take-up of electric cars.,7 days ago,2024-10-15,China News,-,China,-
BBC,https://www.bbc.com/news/articles/c78lk3gxk8mo,School bus ploughs into crowd in China killing 11,"State media reports the driver is in custody, and police are investigating the cause of the incident.",3 Sep 2024,2024-10-15,China News,-,China,-
BBC,https://www.bbc.com/news/articles/cp8e5624x97o,Solar supplier switched over 'ethical concerns',South Kesteven District Council announced a change of supplier for its leisure centre improvements.,27 Sep 2024,2024-10-15,China News,-,China,-
BBC,https://www.bbc.com/news/articles/c39l3ex0mpgo,Student finds scorpion crawling inside Shein parcel,Sofia Alonso-Mossinger found the creature in a bag of boots which she had ordered online.,4 days ago,2024-10-15,China News,-,China,-
BBC,https://www.bbc.com/news/articles/cdx6d654556o,'No preaching' and other tactics as China woos African leaders,China is feting African leaders at a summit in Beijing aimed at strengthening ties.,4 Sep 2024,2024-10-15,China News,-,China,-
BBC,https://www.bbc.com/news/articles/c4gvnym0j0xo,African nations race to put satellites in space,Falling launch costs have given African nations a chance to send their own satellites into orbit.,7 hrs ago,2024-10-15,China News,-,China,-
BBC,https://www.bbc.com/news/articles/cje3wg2z7x5o,"UK shouldn't shun Shein, says ex-B&Q boss","Chinese firm Shein should list in London despite controversy over green credentials, Sir Ian Cheshire says.",25 Sep 2024,2024-10-15,China News,-,China,-
BBC,https://www.bbc.com/news/articles/cp8e15yr1gwo,"Russia on mission to cause mayhem on UK streets, warns MI5","In a wide-ranging speech, Ken McCallum also revealed MI5 had responded to 20 plots backed by Iran since 2022.",6 days ago,2024-10-15,China News,-,China,-
