Source,Link,Headline,Description,Date,Timestamp,Topic,Author,Region,Article_Content
CNN,https://www.cnn.com/2024/04/10/china/china-delegation-northkorea-zhao-leji-intl-hnk/index.html,China is sending its highest-level delegation to North Korea since 2019 to kick off a ‘friendship year’,China’s highest-level visit in nearly five years comes as North Korea aims to strengthen ties with Beijing and Moscow amid coordination between US and its neighbors.,"Apr 11, 2024",2024-10-15,China News,-,China,-
CNN,https://www.cnn.com/2024/04/10/economy/china-fitch-rating-downgrade-intl-hnk/index.html,Fitch downgrades China’s outlook over economic worries,"Fitch downgraded its outlook on China’s credit rating on Tuesday, citing increasing risks to its finances as it faces economic challenges.","Apr 10, 2024",2024-10-15,China News,-,China,-
CNN,https://www.cnn.com/2024/04/10/business/china-netease-blizzard-games-return-intl-hnk/index.html,‘World of Warcraft’ and other hit games return to China as Blizzard and NetEase end dispute,"China’s gaming giant NetEase will bring back the iconic “World of Warcraft” and other popular video games by Blizzard Entertainment to the country, the two companies said in a statement Wednesday.","Apr 10, 2024",2024-10-15,China News,-,China,-
CNN,https://www.cnn.com/2024/04/09/china/xi-jinping-lavrov-russia-china-ukraine-intl-hnk/index.html,Chinese leader Xi meets Russia’s Lavrov as two partners tout strong ties,"Chinese leader Xi Jinping met with top Russian diplomat Sergey Lavrov in Beijing Tuesday, state media reported, in yet another sign of the importance Beijing gives to its increasingly robust ties with Moscow.","Apr 10, 2024",2024-10-15,China News,-,China,-
CNN,https://www.cnn.com/2024/04/08/asia/us-japan-philippines-summit-advance-analysis-intl-hnk/index.html,China concerns bring new unity to once-turbulent US-Japan-Philippines relationship ahead of major White House summit,"When the leaders of the US, Japan and Philippines meet on Thursday, a key topic binds their relationship – common concern over China.","Apr 9, 2024",2024-10-15,China News,-,China,-
CNN,https://www.cnn.com/2024/04/08/business/janet-yellen-china-visit-takeaways-hnk-intl/index.html,"Russia, chopsticks, oversupply: Everything you want to know about Janet Yellen’s China visit","US Treasury Secretary Janet Yellen is wrapping up her second trip to China, where she raised American concerns about Chinese overproduction, warned against support for Russia and, unexpectedly, caused a stir on Chinese social media ...","Apr 9, 2024",2024-10-15,China News,-,China,-
CNN,https://www.cnn.com/videos/world/2024/04/09/janet-yellen-china-visit-marc-stewart-live-first-move-intl-vpx.cnn,Yellen discusses national security concerns on trip to China,US Treasury Secretary Janet Yellen is wrapping up her second trip to China in nine months. The trip is aimed at addressing escalating trade disputes between the world’s largest economies as the two sides try to stabilize relations following a ...,"Apr 9, 2024",2024-10-15,China News,-,China,-
CNN,https://www.cnn.com/2024/04/08/business/china-shimao-group-liquidation-suit-intl-hnk/index.html,Another big Chinese property developer faces a liquidation suit,"Shanghai-based property giant Shimao Group said on Monday that it had received a liquidation petition from a Chinese state-owned bank, in yet another instance of creditors taking legal action to reclaim money from troubled developers in the ...","Apr 8, 2024",2024-10-15,China News,-,China,-
CNN,https://www.cnn.com/videos/tv/2024/04/07/gps-china-nationalist-protests.cnn,On GPS: Why China's richest man is facing a nationalist boycott,"Fareed speaks with The Spectator’s Cindy Yu, host of the magazine’s “China Whispers” podcast, about the online backlash against Zhong Shanshan, founder of the Chinese beverage giant Nongfu Spring, and what this tells us about ...","Apr 8, 2024",2024-10-15,China News,-,China,-
CNN,https://www.cnn.com/2024/04/05/world/video/yellen-in-china-lu-stout-looklive-040508aseg1-cnni-world,Janet Yellen on second visit to China as Treasury Secretary,U.S. Treasury Secy. raises concerns about China’s “overcapacity” risk to global economy as Kristi Lu Stout explains.,"Apr 5, 2024",2024-10-15,China News,-,China,-
CNN,https://www.cnn.com/2024/04/04/business/yellen-us-china-economic-relations-hnk-intl/index.html,Janet Yellen tackles China over flood of cheap goods,Janet Yellen has kicked off her second visit to China as US treasury secretary with a warning of the risk to jobs and businesses posed by overproduction of certain goods in the world’s second largest economy.,"Apr 5, 2024",2024-10-15,China News,-,China,-
CNN,https://www.cnn.com/2024/04/03/tech/taiwan-earthquake-risks-semiconductor-chip-industry-tsmc/index.html,The Taiwan earthquake is a stark reminder of the risks to the region’s chipmaking industry,The world’s biggest chipmaker is working to resume operations following the massive earthquake that struck Taiwan Wednesday — a welcome sign for makers of products ranging from iPhones and computers to cars and washing machines ...,"Apr 4, 2024",2024-10-15,China News,-,China,-
CNN,https://www.cnn.com/travel/china-reopens-mount-everest-tibet-intl-hnk/index.html,China reopens Mount Everest access to foreigners,"For the first time since the pandemic, China is allowing foreign climbers to access Mount Everest via Tibet.","Apr 4, 2024",2024-10-15,China News,-,China,-
CNN,https://www.cnn.com/2024/04/03/business/video/australian-wine-china-tariffs-palun-live-040304pseg2-cnni-business-fast,Australian winemakers rejoice as China business returns,Octtava Wines owner Nikki Palun says she’s elated that Beijing has lifted its tariffs on Australian wine. ,"Apr 4, 2024",2024-10-15,China News,-,China,-
CNN,https://www.cnn.com/2024/04/03/business/europe-china-solar-panel-subsidies-probes/index.html,EU says subsidies may be letting Chinese firms compete unfairly for solar panel contract,The European Union has launched investigations into two groups of companies that include Chinese solar panel makers in the latest salvo against what it suspects is unfair competition from China’s vast manufacturing sector.,"Apr 3, 2024",2024-10-15,China News,-,China,-
CNN,https://www.cnn.com/2024/04/03/tech/china-internet-giants-record-buyback-intl-hnk/index.html,China’s internet giants snap up their own shares to boost flagging stock market value,"Chinese internet giants are buying back their shares at a record pace, as they try to boost their market value in the midst of a historic stock rout in the world’s second largest economy.","Apr 3, 2024",2024-10-15,China News,-,China,-
CNN,https://www.cnn.com/videos/travel/2023/09/22/hidden-treasure-hutong-cooking-hnk-spc-intl.cnn,How a Beijing chef makes pork and chive dumplings,"In one of Beijing’s hutong courtyards, chef Chao Zhou teaches Chinese cooking skills, including how to make dumplings from scratch.","Jun 28, 2024",2024-10-15,China News,-,China,-
CNN,https://www.cnn.com/2024/03/29/china/china-corgi-police-dog-intl-hnk/index.html,Paw patrol: China’s most popular new police officer is a corgi,"China’s most popular new police officer is making waves on social media with his stubby legs, wide grin and wagging tail.","Mar 29, 2024",2024-10-15,China News,-,China,-
CNN,https://www.cnn.com/2024/03/29/world/video/fst-032902aseg2-cnni-world-fast,"U.S., UK accuse Beijing of backing cyberattacks",Beijing has lashed out at the United States and the United Kingdom for imposing sanctions over alleged Chinese government-backed cyberattacks. CNN’s Will Ripley reports.,"Mar 29, 2024",2024-10-15,China News,-,China,-
CNN,https://www.cnn.com/2024/03/28/business/china-goods-exports-trade/index.html,A glut of cheap Chinese goods is flooding the world and stoking trade tensions,"China’s factories are churning out more steel, cars and solar panels than its slowing economy can use, forcing a flood of cheap exports into foreign markets.","Mar 28, 2024",2024-10-15,China News,-,China,-
CNN,https://www.cnn.com/2024/03/28/tech/xi-china-asml-dutch-hnk-intl/index.html,"‘No force’ can stop China’s tech progress, Xi Jinping tells Dutch PM",Chinese leader Xi Jinping has told Dutch Prime Minister Mark Rutte that “no force can stop China’s scientific and technological development.”,"Mar 28, 2024",2024-10-15,China News,-,China,-
CNN,https://www.cnn.com/2024/03/28/china/china-lifts-australia-wine-tariffs-intl-hnk/index.html,China lifts penalties on Australian wine after more than three devastating years,China has announced it is lifting punishing tariffs on Australian wines more than three years after imposing penalties that devastated the industry and were a major point of friction between the trading partners.,"Mar 28, 2024",2024-10-15,China News,-,China,-
CNN,https://www.cnn.com/2024/03/27/business/china-xi-jinping-us-ceos-meeting-intl-hnk/index.html,China’s Xi meets American CEOs to boost confidence in world’s second largest economy,Chinese leader Xi Jinping met more than a dozen US CEOs and academics on Wednesday as Beijing renewed efforts to woo back foreign investors and mend strained relations with the United States.,"Mar 28, 2024",2024-10-15,China News,-,China,-
CNN,https://www.cnn.com/2024/03/27/asia/chinese-workers-killed-pakistan-attack-dasu-dam-intl-hnk/index.html,Chinese workers killed in suicide bomb blast as Pakistan grapples with attacks on Beijing’s interests,"Five Chinese workers and their local driver were killed in a suicide bomb blast in northwest Pakistan on Tuesday, authorities said, the latest in a string of terror attacks that the South Asian country’s military and government say aims to ...","Mar 27, 2024",2024-10-15,China News,-,China,-
CNN,https://www.cnn.com/2024/03/26/china/china-cyber-hacking-accusations-intl-hnk/index.html,"China hits back at US, UK for sanctions on espionage hacks as coordinated pressure on Beijing grows","Beijing has lashed out at the United States and the United Kingdom for imposing sanctions over what they say are Chinese government-backed cyberattacks, calling it an act of “political manipulation.”","Mar 26, 2024",2024-10-15,China News,-,China,-
CNN,https://www.cnn.com/2024/03/26/china/china-soccer-officials-jailed-corruption-intl-hnk-spt/index.html,China sentences ex-soccer chief to life in prison in latest crackdown on sports corruption,"The former head of China’s official soccer association has been sentenced to life in prison by a court in the central Chinese province of Hubei, in the latest crackdown on the country’s corruption-plagued professional football league.","Mar 26, 2024",2024-10-15,China News,-,China,-
CNN,https://www.cnn.com/2024/03/25/travel/china-south-east-asia-travel-train-infrastructure-intl-hnk/index.html,China is trying to connect Southeast Asia by high-speed rail. Here’s how that’s going,"China’s ambitious plan to build a high-speed railway network through Southeast Asia is gaining speed. This is good news for tourists, but not everyone is ready to climb aboard.","Mar 26, 2024",2024-10-15,China News,-,China,-
CNN,https://www.cnn.com/2024/03/25/politics/chinese-hackers-accusations-espionage-campaign/index.html,Biden administration indicts and sanctions Chinese hackers accused of sweeping espionage campaign against US targets,The Biden administration on Monday announced a criminal indictment and sanctions against multiple Chinese hackers for allegedly conducting sweeping hacks against US companies and government officials on behalf of China’s ...,"Mar 25, 2024",2024-10-15,China News,-,China,-
CNN,https://www.cnn.com/2024/03/21/india/china-india-sela-tunnel-border-dispute-intl-hnk/index.html,A high-altitude tunnel is latest flashpoint in India-China border tensions,A tunnel constructed high in the mountains of its northeastern India has become the latest flashpoint in a simmering border dispute between New Delhi and Beijing.,"Mar 22, 2024",2024-10-15,China News,-,China,-
CNN,https://www.cnn.com/2024/03/21/tech/china-apple-tim-cook-shanghai-visit-intl-hnk/index.html,Tim Cook is on a charm offensive in China to revive flagging iPhone sales,Tim Cook is making a high-profile visit to China that coincides with Apple opening a huge new store in Shanghai — its second biggest in the world. It’s all part of a push by the company to reverse a decline in iPhone sales in its biggest ...,"Mar 21, 2024",2024-10-15,China News,-,China,-
CNN,https://www.cnn.com/2024/03/21/entertainment/anna-may-wong-not-your-china-doll-cec/index.html,Hollywood’s first Asian American movie star has long been misunderstood. A new book seeks to change that,Katie Gee Salisbury tells CNN that her new book “Not Your China Doll: The Wild and Shimmering Life of Anna May Wong” aims to tell a different story about the actress.,"Mar 21, 2024",2024-10-15,China News,-,China,-
CNN,https://www.cnn.com/videos/business/2024/03/21/china-nongfu-spring-boycott-stewart-lkl-hnk-vpx.cnn,See why some Chinese people are boycotting a popular brand,A popular brand of bottled water has been the focus of a boycott amid claims the owner isn’t patriotic enough. CNN’s Marc Stewart reports.,"Mar 21, 2024",2024-10-15,China News,-,China,-
CNN,https://www.cnn.com/videos/world/2024/03/20/exp-hong-kong-security-law-article-23-regina-ip-intv-032002aseg1-cnni-world.cnn,"Hong Kong passes second national security law, aligning city more closely with mainland China","CNN’s Rosemary Church talks to Hong Kong lawmaker Regina Ip about Article 23, a national security law that critics and analysts say grants officials sweeping new powers to crack down on dissent and aligns the city more closely with mainland ...","Mar 20, 2024",2024-10-15,China News,-,China,-
CNN,https://www.cnn.com/2024/03/19/china/hong-kong-second-national-security-law-passed-intl-hnk/index.html,"Hong Kong passes second national security law, widening crackdown powers and aligning city more closely with mainland China",Hong Kong’s legislature unanimously passed sweeping new powers on Tuesday that critics and analysts warned would align the financial hub’s national security laws more closely with those used on the Chinese mainland and deepen an ...,"Mar 20, 2024",2024-10-15,China News,-,China,-
CNN,https://www.cnn.com/2024/03/20/asia/blinken-philippines-south-china-sea-intl-hnk/index.html,Blinken stands by US’ ‘ironclad commitment’ to defend Philippines amid fears of China conflict,Secretary of State Antony Blinken on Tuesday reiterated the United States’ “ironclad commitment” to defend the Philippines as rising tensions with China in the South China Sea raise fears of a broader conflict between the two ...,"Mar 20, 2024",2024-10-15,China News,-,China,-
CNN,https://www.cnn.com/videos/world/2024/03/20/article-23-hong-kong-national-security-law-lu-stout-pkg-vpx.cnn,Hear what Hong Kong locals say about city's second national security law,Hong Kong has passed a second national security law. Critics warn that it aligns with the city more closely with mainland China. CNN’s Kristie Lu Stout has more.,"Mar 20, 2024",2024-10-15,China News,-,China,-
CNN,https://www.cnn.com/2024/03/19/world/video/air-pollution-india-vedika-sud-live-031908seg2-cnni-world-fast,Report: 99 of world's worst polluted cities are in Asia,"A study by IQAir has revealed the world’s most polluted cities, and 99 of them are in Asia, as CNN’s Vedika Sud reports. ","Mar 19, 2024",2024-10-15,China News,-,China,-
CNN,https://www.cnn.com/2024/03/19/business/china-evergrande-fraud-csrc-investigation-hnk-intl/index.html,Biggest fraud in Chinese history? Beijing accuses Evergrande of inflating revenues by $78 billion,"Chinese regulators have accused Evergrande and its founder of inflating revenues by $78 billion, putting the insolvent property developer at the heart of the country’s biggest ever financial fraud case.","Mar 19, 2024",2024-10-15,China News,-,China,-
CNN,https://www.cnn.com/2024/03/19/business/video/china-richest-man-bottled-water-stewart-lkl-cnni-business-fast,China's richest man loses billions in nationalist boycott,One of the most popular brands of bottled water in China has become the target of an online boycott in the name of patriotism. Billions have been wiped out from the company’s market capitalization as well as from the personal wealth of its ...,"Mar 19, 2024",2024-10-15,China News,-,China,-
CNN,https://www.cnn.com/2024/03/18/china/china-teacher-li-followers-police-questioning-intl-hnk/index.html,A dissident in Europe is enraging Beijing. Now Chinese police are coming for his social media followers,Li Ying warned his 1.6 million followers on X that authorities are summoning his followers in China for questioning.,"Mar 19, 2024",2024-10-15,China News,-,China,-
CNN,https://www.cnn.com/2024/03/17/asia/russian-election-putin-china-north-korea-intl-hnk/index.html,Six more years of Putin will worry many countries. But not China,"Chinese leader Xi Jinping, and other leaders benefiting from Vladimir Putin’s rejection of a Western-led global order, will be cheering his inevitable victory.","Mar 18, 2024",2024-10-15,China News,-,China,-
CNN,https://www.cnn.com/2024/03/18/economy/china-property-market-weakness-intl-hnk/index.html,China’s all-important property market shows no sign of rebound in new year,"China’s key real estate sector hasn’t shown much improvement following a flurry of government measures taken to boost the industry, even as other parts of the economy seem to be stabilizing.","Mar 18, 2024",2024-10-15,China News,-,China,-
CNN,https://www.cnn.com/2024/03/17/world/video/thailand-pollution-holmes-dnt-031712aseg2-cnni-world-fast,Popular Thai destination ranks as one of the world's most polluted cities,"Thailand’s Chiang Mai ranks as one of the world’s most polluted cities according to IQ-air, a website that monitors air quality. CNN’s Michael Holmes reports.","Mar 17, 2024",2024-10-15,China News,-,China,-
CNN,https://www.cnn.com/2024/03/16/world/video/will-ripley-pkg-031604aseg1-cnni-world-fast,China braces for another possible Trump term,"With U.S. President Joe Biden and former president Donald Trump expected to face off in November, many in China are nervous about what a possible Trump victory could mean for them. CNN’s Will Ripley reports.","Mar 16, 2024",2024-10-15,China News,-,China,-
CNN,https://www.cnn.com/videos/travel/2023/09/22/hidden-treasure-cloisonne-factory-hnk-spc-intl.cnn,Inside China's biggest Cloisonné factory,The metal and enamel patterns of Cloisonné are one of China’s most distinctive art forms. Here’s how craftspeople at a Beijing factory make it.,"Jun 28, 2024",2024-10-15,China News,-,China,-
CNN,https://www.cnn.com/2024/03/14/tech/china-reactions-tiktok-potential-ban-intl-hnk/index.html,"If the US bans TikTok, China will be getting a taste of its own medicine","TikTok is now facing a ban in the United States, a fate that has already befallen a string of American social media giants that tried to make it in China.","Mar 14, 2024",2024-10-15,China News,-,China,-
CNN,https://www.cnn.com/2024/03/14/opinions/tiktok-congress-ban-china-ghitis/index.html,Opinion: The dangers in leaving TikTok at Beijing’s disposal,"Congress is right in wanting to curtail China’s ability to use TikTok to scoop up Americans’ private information, writes Frida Ghitis.","Mar 14, 2024",2024-10-15,China News,-,China,-
CNN,https://www.cnn.com/2024/03/14/world/video/steven-jiang-tiktok-live-031403aseg1-cnni-world-fast,China says banning TikTok is 'an act of bullying' that will backfire on America,CNN’s Steven Jiang looks into what China has to say about the U.S. House vote that could lead to a ban of TikTok.             ,"Mar 14, 2024",2024-10-15,China News,-,China,-
CNN,https://www.cnn.com/videos/tv/2024/03/12/tsmc-chips-intl-spc-hnk.cnn,Rare access: The secret weapon behind Taiwan's chipmaking success,Nearly all of the most advanced semiconductors are made in one place: Taiwan. CNN’s Will Ripley goes behind-the-scenes at the world’s largest and highly secretive chipmaker TSMC to discover how Taiwan has managed to dominate ...,"Mar 14, 2024",2024-10-15,China News,-,China,-
CNN,https://www.cnn.com/2024/03/13/business/china-tiktok-ban-bullying-congress-vote-intl-hnk/index.html,China says US TikTok ban ‘an act of bullying’ that would backfire,China has described a potential TikTok ban as “an act of bullying” that would backfire on America.,"Mar 14, 2024",2024-10-15,China News,-,China,-
CNN,https://www.cnn.com/2024/03/13/china/china-hebei-restaurant-gas-explosion-intl-hnk/index.html,Deadly China restaurant blast rocks city near Beijing,"A deadly suspected gas explosion ripped through a residential neighborhood in northern China on Wednesday, leaving a scene of devastation.","Mar 14, 2024",2024-10-15,China News,-,China,-
CNN,https://www.cnn.com/videos/business/2024/03/13/tiktok-ban-vote-bytedance-china-marc-stewart-vpx.cnn,Hear Chinese official react to potential TikTok ban,"CNN’s Marc Stewart reports on China’s reaction to a potential TikTok ban in the US. The House passed legislation that could ban TikTok in the US unless the app parts ways with its Chinese parent company, ByteDance. It’s a major challenge ...","Mar 13, 2024",2024-10-15,China News,-,China,-
CNN,https://www.cnn.com/2024/03/13/business/china-nongfu-richest-man-nationalists-intl-hnk/index.html,Not Chinese enough? Bottled water empire of China’s richest man is facing a nationalist boycott,"Zhong Shanshan, China’s richest man, is facing a wave of attacks from nationalists who accuse him of a lack of patriotism in a campaign that has hit the price of shares in his beverage company and threatens to hurt its sales.","Mar 13, 2024",2024-10-15,China News,-,China,-
CNN,https://www.cnn.com/videos/tv/2024/03/12/nio-china-ev-intl-spc-hnk.cnn,Can battery swapping help Nio stand out in China's crowded EV market?,"Chinese car makers are leading the global EV race, with giants like BYD, Changan and Geely dominating the market. One start-up is taking a different approach: battery swapping. CNN’s Marc Stewart finds out how it works and whether it ...","Mar 13, 2024",2024-10-15,China News,-,China,-
CNN,https://www.cnn.com/2024/03/12/business/china-moodys-downgrade-vanke-junk-intl-hnk/index.html,China scrambles to prevent another big property developer going bust,Chinese banks are reportedly scrambling to bail out one of the country’s biggest property developers after its credit rating was downgraded to “junk” status by Moody’s on Monday.,"Mar 12, 2024",2024-10-15,China News,-,China,-
CNN,https://www.cnn.com/travel/south-korea-fu-bao-panda-china-intl-hnk/index.html,"South Koreans mourn as country’s first celebrity panda, Fu Bao, heads to China","Ever since her 2020 birth, Fu Bao has been one of South Korea’s biggest celebrities,fans eagerly following every milestone of her life at Everland Resort’s Panda World, a theme park in Yongin city.","Mar 12, 2024",2024-10-15,China News,-,China,-
CNN,https://www.cnn.com/2024/03/11/china/china-two-sessions-takeaway-intl-hnk/index.html,Tighter control and high-tech push: Key takeaways from China’s biggest annual political event,"As China grapples with a struggling economy and an intensifying tech war with the United States, its leaders had one message for the thousands of political elites gathering in Beijing: despite the challenges, the country will stay its course in ...","Mar 12, 2024",2024-10-15,China News,-,China,-
CNN,https://www.cnn.com/videos/world/2024/03/11/exp-china-npc-closing-stewart-fst-031103aseg02-cnni-world.cnn,China's communist party announces vision for 2024,China’s National People’s Congress wraps up today. This annual meeting gives China’s leaders a chance to share their visions for the coming year. CNN’s Marc Stewart reports from Tiananmen Square.,"Mar 12, 2024",2024-10-15,China News,-,China,-
CNN,https://www.cnn.com/2024/03/11/china/china-nationalist-attack-nobel-laureate-mo-yan-intl-hnk/index.html,He was once hailed as the pride of China. Now nationalists are coming for this Nobel laureate,"They’ve gone after bloggers, journalists, artists, comedians and celebrity chefs. Now, some of China’s most zealous online nationalists have a new target in their crosshairs: the country’s first officially recognized Nobel laureate.","Mar 12, 2024",2024-10-15,China News,-,China,-
CNN,https://www.cnn.com/2024/03/11/economy/china-consumer-inflation-rate-rise-intl-hnk/index.html,China’s consumer prices rise for first time in six months. But it’s too soon to say deflation is over,"China’s consumer inflation turned positive for the first time in six months, largely supported by the Lunar New Year holiday, when a spending boom pushed up prices.","Mar 11, 2024",2024-10-15,China News,-,China,-
CNN,https://www.cnn.com/videos/tv/2024/03/11/exp-china-npc-mccarthy-intv-fst-031112aseg02-cnni-world.cnn,China's leaders closely watching U.S. presidential race,"Ahead of the U.S. presidential election, China is weighing the pros and cons of a Trump or Biden presidency. CNN’s Michael Holmes speaks to Simone McCarthy, China Writer for CNN.com.","Mar 11, 2024",2024-10-15,China News,-,China,-
CNN,https://www.cnn.com/2024/03/10/china/china-two-sessions-trump-election-analysis-intl-hnk/index.html,"China is worried about the return of Trump, but it also sees opportunities if he wins","As America bustled through key political moments last week, with voters casting Super Tuesday ballots and President Joe Biden laying out his national priorities in the State of the Union address, China was busy conducting the largest annual ...","Mar 11, 2024",2024-10-15,China News,-,China,-
